,Study_ID,Publication_Year,Author,Title,Publication_Title,Database,Exclude,Reason_ID,Paediatric,Intention_Reported,Deliberate_Intention,Unclear,Accessed,Study_Design,Population_Type,Study_Setting,Study_Location,DOI,Data_Extracted,Bib_Search_Complete,Comments
185,687,2023,"Ngu, Natalie Lee Yee; Karp, Jadon; Taylor, Kirstin","Patient characteristics, outcomes and hospital-level healthcare costs of foreign body ingestion from an Australian, non-prison referral centre",BMJ Open Gastroenterology,Bibliography Search,False,,True,True,True,True,2025-03-30 10:21:11,Retrospective Chart Review,"A retrospective cohort study of patients with FBI was performed at a non-prison referral centre in Melbourne, Australia. International Classification of Disease-10 coding identified patients with gastrointestinal FBI over financial years 2018–2021. Exclusion criteria were food bolus, medication foreign body, object in anus or rectum, or non-ingestion. Criteria for ‘emergent’ classification were oesophagus, size >6 cm, disc batteries, airway compromise, peritonitis, sepsis and/or suspected viscus perforation.",Non-prison referral centre,"Melbourne, Australia",10.1136/ bmjgast-2022-001087,Y,N,
186,688,2023,"Rezazadeh, Amin; Khanghah, Ali Samady; Mousazadeh, Siamak; Noori, Farzad",Removing 216 sharp metal foreign objects from the digestive tract of a 30-year-old male: case report,Annals of Medicine and Surgery (2012),Bibliography Search,True,6,True,True,True,True,2025-04-21 12:24:00,Case Report,"a case of surgically removing plenteous sharp-pointed metallic foreign bodies ingested by a young male deaf-mute bipolar schizoaffective patient from his stomach, intestine, and rectum","Department of Surgery, Fatemi Hospital, Ardabil University of Medical Sciences","Ardabil, Iran",10.1097/MS9.0000000000000377,N,N,Duplicate Study_ID == 439
187,689,2024,,(PDF) Doormatobezoar: first case report of a bezoar formed by doormat ingestion,ResearchGate,Bibliography Search,True,6,True,True,True,True,2025-04-21 12:00:00,Case Report,,,,,N,N,Duplicate
188,690,2024,,Bite the bullet: Lead poisoning after ingestion of 206 lead bullets,ResearchGate,Bibliography Search,True,6,True,True,True,True,2025-03-12 15:37:41,,,,,,N,N,Duplicate Study_ID == 545
189,691,2009,"Song, Young S; Covarrubias, Diego A; Nardi, Peter M",Foreign Body Appendicitis,,Bibliography Search,True,3,False,True,False,True,2025-04-21 12:29:00,Case Report,,,,10.2214/AJR.08.2148,N,N,"""patient cannot recall the exact time of foreign body ingestion,"""
190,692,2016,"Qureshi NA, Cherian N, Ben-Hamida A, Solkar MH",Endoscopic Retrieval of an Intentionally Ingested Mobile Phone in an Adult: First Case Report of its Kind,,Bibliography Search,False,,False,True,True,True,2025-04-21 16:07:00,Case Report,A 30‐year‐old gentleman attended the Accident and Emergency (A&E) department at Tameside Hospital NHS Trust with a history of ingestion of mobile phone eight weeks earlier.,Tameside General Hospital NHS Trust,"Ashton-under-Lyne, UK",,Y,N,
191,693,2015,,Escalating Ingestion of Razor Blades in a Patient With Borderline Personality Disorder,Psychiatrist.com,Bibliography Search,True,11,False,True,True,True,2025-04-21 12:43:00,Case Report,,,,10.4088/PCC.14l01719,N,N,Unable to separate outcomes for multiple ingestions
192,694,1995,"Rodger, C.R.","Frequent Deliberate Self-Harm: Repetition, Suicide and Cost after Three or More Years - C R Rodger, 1995",Scottish Medical Journal,Bibliography Search,True,2,True,True,True,True,2025-04-21 16:11:00,,,,,10.1177/003693309504000104,N,N,Looks at repition rates after deliberate self-harm. No IIFO focus. Exclude.
193,695,2007,"Kim, In Hee; Kim, Hyun Chul; Koh, Kang Hun; Kim, Seong Hun; Kim, Sang Wook; Lee, Seung Ok",Journey of a Swallowed Toothbrush to the Colon,Korean J Intern Med,Bibliography Search,True,9,False,False,False,True,2025-04-21 12:54:00,Case Report,,,,10.3904/kjim.2007.22.2.106,N,N,Not explicitly intentional
