id,Publication Year,Authors,Title,Publication Title,Database,Exclude,Reason ID,Paediatric,Intention Reported,Deliberate intention,Unclear,Accessed,Comments
439,2023,"Rezazadeh, Amin; Khanghah, Ali Samady; Mousazadeh, Siamak; Noori, Farzad",Removing 216 Sharp Metal Foreign Objects From The Digestive Tract Of A 30-Year-Old Male: Case Report,Annals Of Medicine And Surgery (2012),PubMed,False,,,True,True,,03/02/2025,Case report . 30M intentional ingestion of 216 metal objects.
441,2023,"Mezouari F.A., Haddad F., El Rhaoussi F.Z., Hassani M.T.J., Hliwa W., Bellabah A., Badre W.",Ingestion Of Foreign Bodies In Prisons: How Should They Be Managed: Study Of 13 Cases,Turkish Journal Of Gastroenterology,Embase,False,,,True,True,,03/02/2025,Review of 13 prisoners who intentional swallowed objects and the management thereof.
442,2023,"Kaazan, P.; Seow, W.; Tan, Z.; Logan, H.; Philpott, H.; Huynh, D.; Warren, N.; Mcivor, C.; Holtmann, G.; Clark, S. R.; Tse, E.",Deliberate Foreign Body Ingestion In Patients With Underlying Mental Illness: A Retrospective Multicentre Study,Australasian Psychiatry : Bulletin Of Royal Australian And New Zealand College Of Psychiatrists,PubMed,False,,,True,True,,03/02/2025,Retrospective multi-centre study of deliberate foreign body ingestion in people with underlying mental illness.
443,2023,Divsalar P.; Mousa S.H.; Abbasi M.H.,Repeated Intentional Swallowing Of Foreign Objects By An Adolescent Girl Case Report,International Journal Of High Risk Behaviors And Addiction,SCOPUS,False,,True,True,True,,03/02/2025,Case report. 17F repeated intentional ingestions with laparotomy and ovarian injury.
444,2023,"Jaini, Paresh A.; Haliburton, James; Rush, A. John",Management Challenges Of Recurrent Foreign Body Ingestions In A Psychiatric Patient: A Case Report,Journal Of Psychiatric Practice,PubMed,False,,,True,True,True,03/02/2025,"Prolonged case report. 18F repeated intentional ingestions in one case. Documentation of one hospital course with repeated ingestions during. Difficult to get data on individual ingestions, so statistics used to average characteristics across each ingestion. "
450,2023,"Calini, Giacomo; Ortolan, Naima; Battistella, Claudio; Marino, Marco; Bresadola, Vittorio; Terrosu, Giovanni",Endoscopic Failure For Foreign Body Ingestion And Food Bolus Impaction In The Upper Gastrointestinal Tract: An Updated Analysis In A European Tertiary Care  Hospital,European Journal Of Gastroenterology & Hepatology,PubMed,False,,,,,,25/03/2025,
451,2023,"Chauhan, Ashish; Bodh, Vishal; Sharma, Rajesh; Sharma, Brij",Intentional Ingestion Of A Foreign Body - Why We Need Psychiatrists,Middle East Journal Of Digestive Diseases,PubMed,False,,,True,True,,03/02/2025,Case report. 23M intentional ingestion 17 days prior.
456,2023,"Hardy, John C.; Ashcroft, Cody; Kay, Carl; Liane, Billy-Joe; Horn, Christian",Loose Screws: Removal Of Foreign Bodies From The Lower Gastrointestinal Tract,Cureus,PubMed,False,,,,,,25/03/2025,
460,2023,"Das, Siddharth Sankar; Krishnan, Suhasini; Mandhane, Nisha K.; Shalak, Husni S.",Intentional Ingestion Of Foreign Bodies: A Physician'S Agony,Cureus,PubMed,False,,,True,True,,03/02/2025,Case report. 29M ingested nails.
461,2023,"Ishak A., Smith J., Nanda A., Dimaggio F., Thomas R.","Hard To Swallow, Hard To Treat",British Journal Of Surgery,Embase,False,,,True,True,,03/02/2025,Retrospective chart review of 8 patients than ingested on 52 occasions in Croydon.
465,2024,"Pham, Serena T.; Sakai, Osamu; Andreu-Arasa, V. Carlota",Imaging Approach To Ingested Foreign Bodies In The Neck,Neuroradiology,PubMed,False,,,True,True,,03/02/2025,Multiple cases of intentional ingestion.
471,2024,"Sultan, Noran; Attar, Hanin; Sembawa, Hatem; Alharthi, Hind",A Plastic Bezoar Causing Bowel Obstruction: A Case Of Table Cover Ingestion,International Journal Of Surgery Case Reports,PubMed,False,,,True,True,,03/02/2025,Case report. 58F intentional ingestion of table cloth.
475,2024,"Marie A., Sahli-Vivicorsi S., Leclere J.-C.",A Dangerous Appetite,"European Annals Of Otorhinolaryngology, Head And Neck Diseases",Embase,False,,,True,True,,03/02/2025,Case report. 25F ingest multiple objects intentionally. 
476,2024,"Colapkulu Akgul N., Beyazadam D., Ozsoy M.S., Alımoglu O.",Chronic Foreign Body Ingestion In Two Adults With Psychiatric Disorder: Is It Possible To Wait And See? Foreign Body Ingestion,Annals Of Clinical And Analytical Medicine,Embase,False,,,True,True,,03/02/2025,Case series. 2 adults multiple repeat intentional ingestions
482,2024,"Farhadi, Farbod; Mohtadi, Ahmadreza; Pakmehr, Mostafa; Ghaedamini, Hossein; Shafieian, Fatemeh; Aminifar, Seyed Abolfazl",This Is A Successful Removal Of More Than 450 Pieces Of Metal Objects From A Patient'S Stomach: A Case Report,Journal Of Medical Case Reports,PubMed,False,,,,,,25/03/2025,
483,2024,"Dranova, Sabina; Siddiqui, Zohaib; Tobbal, Muhammad; Pitkin, Lisa",Difficult Oesophageal Foreign Body Removal: A Novel Surgical Approach To A Complex Situation,Journal Of Laryngology And Otology,PubMed,False,,,True,True,,03/02/2025,Case report. 20.  Intentional ingestion of butter knife.
484,2024,Fj Buils,Repeated Behavior Of Deliberate Foreign Body Ingestion In A Patient With Psychiatric Disorder,A Case Report. Clin Surg,Google Scholar,False,,,True,True,,03/02/2025,Case report. 29F repeated intentional ingestion of foreign objects.
485,2024,"Bhumi, Sriya; Mago, Sheena; Mavilia-Scranton, Marianna G.; Birk, John W.; Rezaizadeh, Houman",Esophageal Button Battery Retrieval: Time-In May Not Be Everything,Cureus,PubMed,False,,,True,True,,03/02/2025,Case report. 45M intentional ingestion of button battery for secondary gain.
