"ESCAPED UNSCATHED: ATRAUMATIC EXPULSION OF A SHARP FOREIGN BODY",,"Niranjan S., Ranganatha R.S., Nasrullah A., Disilvio B.E.","(Niranjan S.; Ranganatha R.S.; Nasrullah A.; Disilvio B.E.)",,"",,"2024-09-20","Chest (2024) 166:4 Supplement (A5247). Date of Publication: 1 Oct 2024","Chest","2024","166","4","A5247",,"1 Oct 2024","Conference Abstract","CHEST 2024 Annual Meeting","Boston Convention and Exhibition Center, United States, Boston","2024-10-06 to 2024-10-09","","1931-3543 (electronic),0012-3692",,"Elsevier Inc.","SESSION TITLE: Procedures Case Reports Posters (D) SESSION TYPE: Case Report Posters PRESENTED ON: 10/08/2024 10:20 am - 11:05 am INTRODUCTION: Foreign body aspiration is well known to occur in children however, in adults, it typically occurs in the setting of impaired consciousness or deglutition. Here, we present an atypical case of foreign body aspiration. CASE PRESENTATION: An 18-year-old female with major depressive disorder and borderline personality disorder presented for foreign body aspiration. She shared that she uses a box cutter to inflict self-harm and hides it in her mouth. Inadvertently, she aspirated the box cutter and presented to the hospital for the same reason. Besides a mild sore throat, she denied cough, hemoptysis or shortness of breath. She was hemodynamically stable on room air. Her aspiration event was confirmed on a chest x ray, with a blade visualized in the right lower lobe. Pulmonology was consulted emergently with plans for a bronchoscopy the following morning. A CT chest was ordered to confirm the location of the box cutter. Before this was performed, the patient spontaneously expelled the blade by coughing overnight before any intervention took place. The patient did not suffer any consequence. DISCUSSION: Physiologically, the larynx plays a protective role in preventing foreign objects from being aspirated via the closure of the epiglottis, vocal cords and cough reflex (1). In the absence of risk factors, aspiration of foreign objects as in our patient is unlikely. Additionally, aspirated sharp foreign objects are extremely hazardous and pose a risk of catastrophic complications to the airway including hemorrhage, post obstructive pneumonia, lung abscess and bronchiectasis. Emergent intervention using rigid bronchoscopy is warranted as the spontaneous and uneventful expulsion of sharp objects as in our patient, is rare in literature (2). CONCLUSIONS: Foreign body aspiration of sharp objects calls for immediate intervention due to the risk of lethal complications, given that the occurrence of spontaneous and atraumatic expulsion is extremely rare. REFERENCE #1: Kent SE, Watson MG. Laryngeal foreign bodies. J Laryngol Otol. 1990;104(2):131-3. REFERENCE #2: Jackson C. Prognosis of foreign body in the lung. JAMA. 1921;77(15):1178. DISCLOSURES: Speaker/Speaker's Bureau relationship with Boehringer-Ingelheim Please note: Sept 2021-Present by Briana DiSilvio, value=Honoraria Speaker/Speaker's Bureau relationship with AstraZeneca Please note: Jan 2023- present by Briana DiSilvio, value=Honoraria No relevant relationships by Adeel Nasrullah No relevant relationships by Sitara Niranjan No relevant relationships by Ravi Shankar Ranganatha",,,"","","foreign body","adult, ambient air, automutilation, bleeding, bronchiectasis, bronchoscopy, case report, child, clinical article, complication, conference abstract, consciousness, coughing, diagnosis, dyspnea, epiglottis, female, foreign body aspiration, hemoptysis, human, larynx, lung abscess, major depression, obstructive pneumonia, risk factor, self poisoning, sore throat, swallowing, therapy, thorax radiography, vocal cord",,,,,,,"",,"English","English",,,L2034595368,10.1016/j.chest.2024.06.3122,"http://dx.doi.org/10.1016/j.chest.2024.06.3122","https://www.embase.com/search/results?subaction=viewrecord&id=L2034595368&from=export","https://libkey.io/libraries/1675/openurl?sid=EMBASE&sid=EMBASE&issn=19313543&id=doi:10.1016%2Fj.chest.2024.06.3122&atitle=ESCAPED+UNSCATHED%3A+ATRAUMATIC+EXPULSION+OF+A+SHARP+FOREIGN+BODY&stitle=Chest&title=Chest&volume=166&issue=4&spage=A5247&epage=&aulast=Niranjan&aufirst=SITARA&auinit=S.&aufull=Niranjan+S.&coden=&isbn=&pages=A5247-&date=2024&auinit1=S&auinitm=","Copyright 2024 Elsevier B.V., All rights reserved."
"Gastrotomy for removal of a gastric fishhook foreign body in a blue catfish (Ictalurus furcatus)",,"Stratton H.S., Davis R., Lewbart G.A.","(Stratton H.S., hsstratt@ncsu.edu; Lewbart G.A.) Department of Clinical Sciences, North Carolina State University, College of Veterinary Medicine, Raleigh, NC, United States. , (Davis R.) L2 Aquariums, Grand Prairie, TX, United States.","H.S. Stratton, Department of Clinical Sciences, North Carolina State University, College of Veterinary Medicine, Raleigh, NC, United States. Email: hsstratt@ncsu.edu","","2024-06-13","2024-08-30","Veterinary Record Case Reports (2024) 12:3 Article Number: e918. Date of Publication: 1 Sep 2024","Veterinary Record Case Reports","2024","12","3",,,"1 Sep 2024","Article",,,,,"2052-6121 (electronic)",,"John Wiley and Sons Inc","An adult blue catfish (Ictalurus furcatus) presented for ingestion of a fishing lure. Manual retrieval of the fishing lure was attempted via palpation of the stomach through the oral cavity and oesophagus. The lure was palpable within the lumen of the stomach, but it could not be safely extracted, as one of the treble-barb hooks on the lure had perforated the gastric wall. The lure was surgically removed via gastrotomy. Six weeks following surgery, the patient experienced dehiscence of the skin incision, which was left open for healing by second intention. The patient made a complete recovery. This is the first documented gastrotomy for successful removal of a gastric fishhook foreign body in a teleost fish.",,"fish,fishing lure,foreign body,gastrotomy","","analgesic agent (intramuscular drug administration), enrofloxacin, ketoprofen, procaine, tricaine","catfish, foreign body (surgery), gastric fishhook foreign body (surgery), gastrotomy","adult, article, blood biochemistry, body constitution, Butterfly iQ, fishing, fishing lure, general device, ingestion, largemouth bass, mouth cavity, nonhuman, palpation, physical examination, poliglecaprone suture, skin abrasion, skin incision, stomach wall, ultrasound, ultrasound scanner, water quality","syncaine (Syndel)","Elanco, Syndel, Zoetis","Butterfly iQ","Ethicon","enrofloxacin (93106-60-6), ketoprofen (22071-15-4, 57495-14-4), procaine (51-05-8, 59-46-1), tricaine (886-86-2)",,"Biophysics, Bioengineering and Medical Instrumentation (27), Drug Literature Index (37), Gastroenterology (48)",,"English","English",,,L2030134175,10.1002/vrc2.918,"http://dx.doi.org/10.1002/vrc2.918","https://www.embase.com/search/results?subaction=viewrecord&id=L2030134175&from=export","https://libkey.io/libraries/1675/openurl?sid=EMBASE&sid=EMBASE&issn=20526121&id=doi:10.1002%2Fvrc2.918&atitle=Gastrotomy+for+removal+of+a+gastric+fishhook+foreign+body+in+a+blue+catfish+%28Ictalurus+furcatus%29&stitle=Vet.+Rec.+Case+Rep.&title=Veterinary+Record+Case+Reports&volume=12&issue=3&spage=&epage=&aulast=Stratton&aufirst=Hayley+S.&auinit=H.S.&aufull=Stratton+H.S.&coden=&isbn=&pages=-&date=2024&auinit1=H&auinitm=S","Copyright 2024 Elsevier B.V., All rights reserved."
"Repeated intentional foreign body ingestion, what can be done?",,"Hoey P., Ryan K., McDonald C., Brown N.J., Boon K., Grimpen F., Appleyard M.","(Hoey P., uqphoey@uq.edu.au; Ryan K.; Grimpen F.; Appleyard M.) Department of Gastroenterology and Hepatology, Royal Brisbane & Women's Hospital, Brisbane, QLD, Australia. , (Hoey P., uqphoey@uq.edu.au) Faculty of Medicine, University of Queensland, Brisbane, QLD, Australia. , (McDonald C.; Brown N.J.) Emergency & Trauma Centre, Royal Brisbane & Women's Hospital, Brisbane, QLD, Australia. , (Boon K.) Consultant Liaison Psychiatry, Royal Brisbane & Women's Hospital, Brisbane, QLD, Australia.","P. Hoey, Department of Gastroenterology and Hepatology, Royal Brisbane & Women's Hospital, Brisbane, QLD, Australia. Email: uqphoey@uq.edu.au","","2024-06-11","2024-07-22","EMA - Emergency Medicine Australasia (2024) 36:4 (659-661). Date of Publication: 1 Aug 2024","EMA - Emergency Medicine Australasia","2024","36","4","659","661","1 Aug 2024","Article",,,,,"1742-6723 (electronic),1742-6731",,"John Wiley and Sons Inc","Repeated intentional foreign body ingestion (RIFBI) in patients with Emotionally Unstable Personality Disorder (EUPD) is a common clinical presentation to the emergency department. The relationship between repeated foreign body ingestion and a co-existent personality disorder diagnosis is complex, making it challenging to manage. Our institution implemented a novel interdisciplinary model of care for RIFBI as a way of improving health outcomes in this cohort of patients. Our observations following the model of care are presented herein. We encourage other health networks to adopt this model of care for managing RIBFI in EUPD.",,"Emotionally Unstable Personality Disorder,endoscopy,foreign body ingestion","","","foreign body, ingestion","article, aspiration pneumonia, borderline state, caregiver, emergency ward, endoscopy, health care, hospitalization, human, length of stay, mental disease, palliative therapy, personality, personality disorder",,,,,,,"Psychiatry (32), Internal Medicine (6)",,"English","English",,38837326,L2030073545,10.1111/1742-6723.14451,"http://dx.doi.org/10.1111/1742-6723.14451","https://www.embase.com/search/results?subaction=viewrecord&id=L2030073545&from=export","https://libkey.io/libraries/1675/openurl?sid=EMBASE&sid=EMBASE&issn=17426723&id=doi:10.1111%2F1742-6723.14451&atitle=Repeated+intentional+foreign+body+ingestion%2C+what+can+be+done%3F&stitle=EMA+Emerg.+Med.+Australas.&title=EMA+-+Emergency+Medicine+Australasia&volume=36&issue=4&spage=659&epage=661&aulast=Hoey&aufirst=Paris&auinit=P.&aufull=Hoey+P.&coden=EMAMC&isbn=&pages=659-661&date=2024&auinit1=P&auinitm=","Copyright 2024 Elsevier B.V., All rights reserved."
"Tracheal Stent Ingestion: Unveiling Complications and Innovations in Management",,"Vikash F., Osayande O., Pang M.","(Vikash F., vikashjs86@outlook.com) Department of Medicine, Jacobi Medical Center, Albert Einstein College of Medicine, Bronx, NY, United States. , (Osayande O., Oosagiede6@gmail.com; Pang M., Pang.Maoyin@mayo.edu) Division of Gastroenterology and Hepatology, Mayo Clinic, Jacksonville, FL, United States.","M. Pang, Division of Gastroenterology and Hepatology, Mayo Clinic, Jacksonville, FL, United States. Email: Pang.Maoyin@mayo.edu","","2024-07-29","2024-07-31","ACG Case Reports Journal (2024) 11:7. Date of Publication: 19 Jul 2024","ACG Case Reports Journal","2024","11","7",,,"19 Jul 2024","Article",,,,,"2326-3253 (electronic)",,"Lippincott Williams and Wilkins","Airway stenting has become integral to the therapeutic endoscopic management of benign and malignant obstructive airway diseases. Despite the increased use of stents, the absence of clear guidelines for surveillance and maintenance poses the potential for unique stent-associated complications. Our case reports a rare incident of tracheal stent dislodgement, leading to its ingestion and unexpected discovery within the stomach. This case serves the purpose of shedding light on a rare yet potentially life-threatening complication and discussing types of stent and characteristics to enhance gastroenterologists' understanding of stent-related challenges and equips them to anticipate and strategize the appropriate course of action. Copyright:",,"endoscopy,foreign body,migration,stomach,tracheal stent","","","endotracheal stent (adverse device effect), trachea stenosis (complication, surgery, therapy)","adult, AERO stent, article, artificial ventilation, balloon dilatation, bronchoscopy, case report, clinical article, computer assisted tomography, coughing, COVID-19 pneumonia (diagnosis), endoscopic retrieval device, follow up, gastroenterologist, gastrointestinal endoscopy, hospitalization, human, hypertension, male, medical history, middle aged, morbid obesity, non insulin dependent diabetes mellitus, stent complication (complication), stent dislodgement (complication), stent fracture (complication), stent ingestion (complication), stomach fundus, trachea reconstruction, trachea resection, tracheomalacia, treatment failure, veno-venous ECMO",,,"AERO stent (Merit, Jordan), Roth Net (US Endoscopy, United States)","Merit, Merit (Jordan), US Endoscopy, US Endoscopy (United States)",,,"Otorhinolaryngology (11), Radiology (14), Biophysics, Bioengineering and Medical Instrumentation (27), Gastroenterology (48)",,"English","English",,,L2033440399,10.14309/crj.0000000000001404,"http://dx.doi.org/10.14309/crj.0000000000001404","https://www.embase.com/search/results?subaction=viewrecord&id=L2033440399&from=export","https://libkey.io/libraries/1675/openurl?sid=EMBASE&sid=EMBASE&issn=23263253&id=doi:10.14309%2Fcrj.0000000000001404&atitle=Tracheal+Stent+Ingestion%3A+Unveiling+Complications+and+Innovations+in+Management&stitle=ACG+Case+Rep.+J.&title=ACG+Case+Reports+Journal&volume=11&issue=7&spage=&epage=&aulast=Vikash&aufirst=Fnu&auinit=F.&aufull=Vikash+F.&coden=&isbn=&pages=-&date=2024&auinit1=F&auinitm=","Copyright 2024 Elsevier B.V., All rights reserved."
"Difficult oesophageal foreign body removal: a novel surgical approach to a complex situation",,"Dranova S., Siddiqui Z., Tobbal M., Pitkin L.","(Dranova S., sabina.dranova1@nhs.net; Siddiqui Z.; Pitkin L.) ENT Department, Frimley Park Hospital, Frimley, United Kingdom. , (Tobbal M.) General Surgery, Frimley Park Hospital, Frimley, United Kingdom.","S. Dranova, ENT Department, Frimley Park Hospital, Frimley, United Kingdom. Email: sabina.dranova1@nhs.net","","2024-01-30","2024-05-30","Journal of Laryngology and Otology (2024) 138:6 (703-706). Date of Publication: 15 Jun 2024","Journal of Laryngology and Otology","2024","138","6","703","706","15 Jun 2024","Article",,,,,"1748-5460 (electronic),0022-2151",,"Cambridge University Press","Background Ingested foreign bodies pose a unique challenge in medical practice, especially when lodged in the oesophagus. While endoscopic retrieval is the standard treatment, certain cases require more innovative approaches. Methods This paper reports the case of a patient who intentionally ingested a butter knife that lodged in the thoracic oesophagus. After multiple endoscopic attempts, a lateral neck oesophagotomy, aided using a Hopkins rod camera and an improvised trochar as a protective port, was performed. Results The foreign body was successfully extracted without causing oesophageal perforation. The patient was made nil by mouth, with nasogastric feeding only until a swallow assessment after one week. The patient was discharged and recovered well. Conclusion This case illustrates a successful, innovative approach to removing a foreign body in a high-risk patient, highlighting the significance of adaptability in surgical practice. It emphasises the need for individualised approaches based on the patient's history, the nature and location of the foreign body, and associated risks.",,"endoscopy,esophagus,Foreign bodies","","","esophagus foreign body (surgery), surgical approach","abdominal radiography, adult, article, automutilation, camera, case report, clinical article, computer assisted tomography, contrast enhancement, emergency ward, endoscope, endoscopic forceps, endotracheal tube, esophagus, esophagus perforation, fiberoscope, gastroenterology, gastrotomy, general surgery, hemodynamics, Hopkins rod camera, hospital, hospital discharge, human, laparotomy, laryngeal mask, mediastinum, medical history, mobilization, multidisciplinary team, nasogastric tube, nausea, nose feeding, omohyoid muscle, open surgery, patient, physical examination, polyglactin, polyglactin suture, rigid endoscope, stomach wall, subcutaneous tissue, surgical landmark, suture, swallowing, thoracotomy, thorax pain, thorax radiography",,,"Hopkins rod camera, Vicryl",,,,"Otorhinolaryngology (11), Radiology (14), Gastroenterology (48)",,"English","English",,38224046,L2029817938,10.1017/S0022215124000033,"http://dx.doi.org/10.1017/S0022215124000033","https://www.embase.com/search/results?subaction=viewrecord&id=L2029817938&from=export","https://libkey.io/libraries/1675/openurl?sid=EMBASE&sid=EMBASE&issn=17485460&id=doi:10.1017%2FS0022215124000033&atitle=Difficult+oesophageal+foreign+body+removal%3A+a+novel+surgical+approach+to+a+complex+situation&stitle=J.+Laryngol.+Otol.&title=Journal+of+Laryngology+and+Otology&volume=138&issue=6&spage=703&epage=706&aulast=Dranova&aufirst=Sabina&auinit=S.&aufull=Dranova+S.&coden=JLOTA&isbn=&pages=703-706&date=2024&auinit1=S&auinitm=","Copyright 2024 Elsevier B.V., All rights reserved."
"Utilization of Single-Incision Laparoscopy in the Management of Ingested Magnets",,"Ardila S., Woodley L., Ulloa E., Fernandez J., Bornstein J., Seims A.","(Ardila S.; Woodley L.; Ulloa E.; Seims A., aaron.seims@orlandohealth.com) Department of Surgery, Arnold Palmer Hospital for Children, Orlando, FL, United States. , (Fernandez J.; Bornstein J.) Department of Gastroenterology, Arnold Palmer Hospital for Children, Orlando, FL, United States.","A. Seims, Department of Surgery, Arnold Palmer Hospital for Children, 1720 S. Orange Ave., Ste 500, Orlando, FL, United States. Email: aaron.seims@orlandohealth.com","","2023-12-12","2024-07-08","Journal of Laparoendoscopic and Advanced Surgical Techniques (2024) 34:6 (530-534). Date of Publication: 1 Jun 2024","Journal of Laparoendoscopic and Advanced Surgical Techniques","2024","34","6","530","534","1 Jun 2024","Article",,,,,"1557-9034 (electronic),1092-6429",,"Mary Ann Liebert Inc.","Background: A ban on neodymium magnets was lifted by the U.S. Consumer Product Safety Commission in 2016. Pediatric gastroenterologists and surgeons were increasingly tasked with removing these problematic objects. The purpose of this study was to assess the utility of single-incision laparoscopic surgery (SILS) in the management of ingested magnets. Patients and Methods: This is a single-center, retrospective assessment of surgical interventions for ingested magnets. International Classification of Disease, 10th revision codes were used to identify 349 patients ≤21 years of age evaluated for foreign body ingestion over a 4.5-year period. A medical record review helped isolate 29 (8.3%) magnet ingestions, 9 requiring surgical intervention. RedCap was used for analysis. Results: Of 9 surgical patients, 7 underwent SILS intervention by 1 surgeon. Another surgeon performed an open operation, whereas a third performed a multiport operation. Of the 7 SILS cases, 3 were completed without conversion to open. In one of these cases, bowel resection with primary anastomosis was performed. For SILS cases, average operating room time was 109 minutes (38-170 minutes), time to enteral feeds was 23 hours (0.28-79.2 hours), and hospital length of stay (LOS) was 3.8 days (1.96-6.68 days). Thirty-day readmission for SILS was 14.3%. No other complications were observed. Conclusions: SILS has been safely utilized for magnet retrieval. It offers an ability to identify the affected intestinal segment and an opportunity to intervene extracorporeally through an uncapped port. In addition, knowing where matted bowel is located can direct a limited incision during conversion to laparotomy. This may confer benefits of decreased pain, shortened time to enteral feeds, and decreased hospital LOS.",,"buckeyball,foreign body ingestion,neodymium,rare earth magnet","","bicarbonate plus macrogol 3350 plus potassium chloride plus sodium chloride plus sodium sulfate (special situation for pharmacovigilance)","foreign body (surgery), laparoscopic surgery, magnet, single incision laparoscopic surgery","article, case report, child, conversion to open surgery, diverticulectomy, enteric feeding, female, hospital readmission, human, ICD-10, ingestion, intestine anastomosis, intestine resection, laparoscopic access port, laparoscopy, laparotomy, length of stay, major clinical study, male, Meckel diverticulum (surgery), medical record review, operating room, operation duration, pediatric surgery, preschool child, retrospective study, school child, single-incision laparoscopic appendectomy, stomach tube, surgeon, surgical patient","golytely",,,,"bicarbonate plus macrogol 3350 plus potassium chloride plus sodium chloride plus sodium sulfate (1134204-96-8)",,"Drug Literature Index (37), Gastroenterology (48), Pediatrics and Pediatric Surgery (7)",,"English","English",,38016150,L2028871936,10.1089/lap.2023.0394,"http://dx.doi.org/10.1089/lap.2023.0394","https://www.embase.com/search/results?subaction=viewrecord&id=L2028871936&from=export","https://libkey.io/libraries/1675/openurl?sid=EMBASE&sid=EMBASE&issn=15579034&id=doi:10.1089%2Flap.2023.0394&atitle=Utilization+of+Single-Incision+Laparoscopy+in+the+Management+of+Ingested+Magnets&stitle=J.+Laparoendosc.+Adv.+Surg.+Techn.&title=Journal+of+Laparoendoscopic+and+Advanced+Surgical+Techniques&volume=34&issue=6&spage=530&epage=534&aulast=Ardila&aufirst=Sara&auinit=S.&aufull=Ardila+S.&coden=&isbn=&pages=530-534&date=2024&auinit1=S&auinitm=","Copyright 2024 Elsevier B.V., All rights reserved."
"Imaging approach to ingested foreign bodies in the neck",,"Pham S.T., Sakai O., Andreu-Arasa V.C.","(Pham S.T.; Andreu-Arasa V.C., vanesacarlota.andreuarasa@bmc.org) Department of Radiology, Boston University Chobanian & amp; Avedisian School of Medicine/Boston Medical Center, Boston, MA, United States. , (Sakai O.) Division of Neuroradiology, Department of Radiology, Harvard Medical School/Massachusetts General Hospital, Boston, MA, United States. , (Andreu-Arasa V.C., vanesacarlota.andreuarasa@bmc.org) Division of Neuroradiology, Department of Radiology, VA Boston Healthcare System, Boston, MA, United States.","V.C. Andreu-Arasa, Department of Radiology, Boston University Chobanian & amp; Avedisian School of Medicine/Boston Medical Center, Boston, MA, United States. Email: vanesacarlota.andreuarasa@bmc.org","","2024-04-22","2024-06-11","Neuroradiology (2024) 66:6 (867-881). Date of Publication: 1 Jun 2024","Neuroradiology","2024","66","6","867","881","1 Jun 2024","Review",,,,,"1432-1920 (electronic),0028-3940",,"Springer Science and Business Media Deutschland GmbH","Foreign body ingestion is a common clinical occurrence worldwide, with high morbidity in the pediatric population and in adult patients with intentional attempts. Coins and button battery ingestions are more common among children. Bone impaction and swallowed dentures are usually seen in older adults. While most ingested foreign bodies pass through the gastrointestinal tract spontaneously with no complications, some require endoscopic and/or surgical intervention. Complications such as pharyngoesophageal ulceration, perforation, stricture, and deep neck infection can develop without timely diagnosis and management. The purpose of this article is to familiarize radiologists with the imaging approach to assess for characteristics and impacted locations of ingested foreign bodies in the neck.",,"CT neck,Foreign body ingestion,Imaging approach,Neck,Neck radiographs,Radiologists","","","foreign body, imaging, neck","bone screw, computer assisted tomography, cricopharyngeus muscle, denture, direct laryngoscopy, electric battery, electronic device, forceps, gastrointestinal tract, general anesthesia, human, impedance, laryngeal mirror, laryngoscope, magnet, nuclear magnetic resonance imaging, oropharynx, partial denture, partial upper denture, perforation, pyriform sinus, review, surgical approach, tongue depressor, tracheoesophageal fistula, tube introduction forceps, ulcer, upper esophagus sphincter, X ray film",,,,,,,"Radiology (14), Neurology and Neurosurgery (8)",,"English","English",,38619570,L2029418904,10.1007/s00234-024-03348-5,"http://dx.doi.org/10.1007/s00234-024-03348-5","https://www.embase.com/search/results?subaction=viewrecord&id=L2029418904&from=export","https://libkey.io/libraries/1675/openurl?sid=EMBASE&sid=EMBASE&issn=14321920&id=doi:10.1007%2Fs00234-024-03348-5&atitle=Imaging+approach+to+ingested+foreign+bodies+in+the+neck&stitle=Neuroradiology&title=Neuroradiology&volume=66&issue=6&spage=867&epage=881&aulast=Pham&aufirst=Serena+T.&auinit=S.T.&aufull=Pham+S.T.&coden=NRDYA&isbn=&pages=867-881&date=2024&auinit1=S&auinitm=T","Copyright 2024 Elsevier B.V., All rights reserved."
