"Profiling of swallowing function in head and neck cancer patients prior to radiation therapy-Findings from a tertiary hospital in South India",,"Jaison Varghese J., Aithal V.U., Sharan K., Maiya A.G., Rajashekhar B.","(Jaison Varghese J.; Aithal V.U., vrajaithal@manipal.edu; Rajashekhar B.) Department of Speech and Hearing, Manipal College of Health Professions, Manipal Academy of Higher Education, Karnataka, Manipal, India. , (Sharan K.) Department of Radiation Oncology, Justice KS Hegde Medical College, Nitte (Deemed to be University), Karnataka, Mangalore, India. , (Maiya A.G.) Department of Physiotherapy, Centre for Diabetic Foot Care and Research (CDFCR), Manipal College of Health Professions (MCHP), Manipal Academy of Higher Education (MAHE), Karnataka, Manipal, India.","V.U. Aithal, Department of Speech and Hearing, Manipal College of Health Professions, Manipal Academy of Higher Education, Karnataka, Manipal, India. Email: vrajaithal@manipal.edu","","2024-04-12","2024-04-22","Preventive Medicine Reports (2024) 41 Article Number: 102713. Date of Publication: 1 May 2024","Preventive Medicine Reports","2024","41",,,,"1 May 2024","Article",,,,,"2211-3355 (electronic)",,"Elsevier Inc.","Purpose: Head and neck cancer (HNC) patients often face difficulties with swallowing, which can be due to the cancer itself or the treatment modalities like radiation therapy. The presentation of HNC can vary between developing and developed countries due to socioeconomic factors. The current study aimed to profile the swallowing function of HNC patients before starting radiation therapy in a tertiary hospital in India. Method: This cross-sectional observational study examined patients with HNC who were scheduled for radiation therapy. The Functional Oral Intake Scale (FOIS) and Karnofsky Performance Status Scale were used to assess the patients’ swallowing status and functional abilities, respectively. The study also evaluated the relationship between swallowing function and clinical-demographic factors. Results: Our assessment of 162 HNC patients found that the cancer site significantly affects swallowing. Although 92% of patients had an oral diet, 64% made dietary modifications. Patients with non-oral intake had either oral or pharyngeal cancer, and over 80% of oral cancer patients and 60% of those with pharyngeal cancer had already made changes to their diet. Patients with laryngeal cancer had a better oral intake, with 58% reporting no swallowing issues. Conclusion: Patients with HNC scheduled for radiation therapy may experience varying degrees of swallowing difficulty. Early intervention and teaching of safe swallowing strategies are crucial to prepare for the potential worsening of swallowing difficulties resulting from the treatment. Advanced tumor stages and oral/pharyngeal cancers increase the risk of significant swallowing issues.",,,"","antineoplastic agent (drug therapy, special situation for pharmacovigilance)","cancer patient, cancer radiotherapy, clinical feature, head and neck cancer (drug therapy, radiotherapy), swallowing, tertiary care center","adult, aged, article, burning sensation, cancer chemotherapy, cancer localization, cancer staging, clinical assessment, clinical evaluation, clinical examination, coughing, cross-sectional study, data analysis software, demographics, diet therapy, dysphagia, dyspnea, early intervention, female, foreign body, functional assessment, functional oral intake scale, functional status, headache, health status, hoarseness, human, Karnofsky Performance Status, larynx cancer, major clinical study, male, middle aged, mouth cancer, neck swelling, observational study, odynophagia, otalgia, pain, pharynx cancer, socioeconomics, sore throat, ulcer, very elderly",,,,,,,"Otorhinolaryngology (11), Radiology (14), Cancer (16), Drug Literature Index (37)",,"English","English",,,L2031478572,10.1016/j.pmedr.2024.102713,"http://dx.doi.org/10.1016/j.pmedr.2024.102713","https://www.embase.com/search/results?subaction=viewrecord&id=L2031478572&from=export","https://libkey.io/libraries/1675/openurl?sid=EMBASE&sid=EMBASE&issn=22113355&id=doi:10.1016%2Fj.pmedr.2024.102713&atitle=Profiling+of+swallowing+function+in+head+and+neck+cancer+patients+prior+to+radiation+therapy-Findings+from+a+tertiary+hospital+in+South+India&stitle=Preventive+Med.+Reports&title=Preventive+Medicine+Reports&volume=41&issue=&spage=&epage=&aulast=Jaison+Varghese&aufirst=Janet&auinit=J.&aufull=Jaison+Varghese+J.&coden=&isbn=&pages=-&date=2024&auinit1=J&auinitm=","Copyright 2024 Elsevier B.V., All rights reserved."
"A plastic bezoar causing bowel obstruction: A case of table cover ingestion",,"Sultan N., Attar H., Sembawa H., Alharthi H.","(Sultan N., noran.a.m.s@hotmail.com; Alharthi H.) General Surgery Department, King Abdulaziz Hospital, Makkah, Saudi Arabia. , (Attar H.) General Surgery Department, Alnoor Specialist Hospital, Makkah, Saudi Arabia. , (Sembawa H.) General Surgery Department, Umm Al-Qura University, Makkah, Saudi Arabia.","N. Sultan, General Surgery Department, King Abdulaziz Hospital, Makkah, Saudi Arabia. Email: noran.a.m.s@hotmail.com","","2024-03-26","2024-04-02","International Journal of Surgery Case Reports (2024) 117 Article Number: 109506. Date of Publication: 1 Apr 2024","International Journal of Surgery Case Reports","2024","117",,,,"1 Apr 2024","Article",,,,,"2210-2612",,"Elsevier Ltd","Introduction and importance: A bezoar is an indigestible food or other material within the gastrointestinal tract. It can be ingested intentionally or accidentally. The small bowel bezoar prevalence ranges between 0.4 % and 4 %, and the prevalence is less than 0.5 % for gastric bezoars. There are different types of bezoars, but the mention of a plastic bezoar rarely appears in the literature. To our knowledge, this is the first reported case of a plastic bezoar in the Kingdom of Saudi Arabia. Case presentation: A 58-year-old woman was admitted for acute kidney injury, and while working her up, it was discovered that she had a possible foreign body on computerized tomography scan. As a result, she underwent exploratory laparotomy with the findings of plastic foreign objects identified 90 cm from the ileocecal valve and other objects identified in the stomach. Clinical discussion: The impaction of these materials often occurs in narrow areas such as the lower esophagus, duodenum, ileocecal valve or even the anus. In this unique case, two points of impaction were noted: the first was in the small bowel and the second point in the stomach. The approach to such cases could be Endoscopic versus surgical or even chemical dissolution as a choice of treatment is dependent on multiple factors. Conclusion: The approach to these cases is multidisciplinary and depends on the availability of services and resources at the treating hospital. Reporting such cases helps in managing challenging situations. Additionally, a psychiatric assessment is a crucial step.",,"Acute abdomen,Bezoar,Foreign body,Plastic bezoar,Small bowel obstruction","plastic","mirtazapine (drug therapy, special situation for pharmacovigilance), tazobactam (special situation for pharmacovigilance)","bezoar (surgery), intestine obstruction (surgery)","abdominal pain, acute kidney failure (therapy), adult, article, breathing rate, case report, clinical article, computer assisted tomography, digital rectal examination, female, gastrotomy, human, ileocecal valve, intestine surgery, laparotomy, loose feces, middle aged, nasogastric tube, oxygen saturation, renal replacement therapy, resuscitation, Saudi Arabia, separation anxiety (drug therapy), stomach obstruction",,,,,"mirtazapine (61337-67-5, 85650-52-8), tazobactam (93528-38-2)",,"Radiology (14), Biophysics, Bioengineering and Medical Instrumentation (27), Drug Literature Index (37), Gastroenterology (48), Surgery (9)",,"English","English",,,L2031099727,10.1016/j.ijscr.2024.109506,"http://dx.doi.org/10.1016/j.ijscr.2024.109506","https://www.embase.com/search/results?subaction=viewrecord&id=L2031099727&from=export","https://libkey.io/libraries/1675/openurl?sid=EMBASE&sid=EMBASE&issn=22102612&id=doi:10.1016%2Fj.ijscr.2024.109506&atitle=A+plastic+bezoar+causing+bowel+obstruction%3A+A+case+of+table+cover+ingestion&stitle=Int.+J.+Surg.+Case+Rep.&title=International+Journal+of+Surgery+Case+Reports&volume=117&issue=&spage=&epage=&aulast=Sultan&aufirst=Noran&auinit=N.&aufull=Sultan+N.&coden=&isbn=&pages=-&date=2024&auinit1=N&auinitm=","Copyright 2024 Elsevier B.V., All rights reserved."
"A dangerous appetite",,"Marie A., Sahli-Vivicorsi S., Leclere J.-C.","(Marie A., antoine.marie@chu-brest.fr; Sahli-Vivicorsi S.; Leclere J.-C.) Service ORL du CHRU de Brest, 2, avenue Foch, Brest, France.","A. Marie, Service ORL du CHRU de Brest, 2, avenue Foch, Brest, France. Email: antoine.marie@chu-brest.fr","","2023-05-24","2024-04-12","European Annals of Otorhinolaryngology, Head and Neck Diseases (2024) 141:2 (113-114). Date of Publication: 1 Mar 2024","European Annals of Otorhinolaryngology, Head and Neck Diseases","2024","141","2","113","114","1 Mar 2024","Article",,,,,"1879-7296",,"Elsevier Masson s.r.l.",,,,"","","foreign body (diagnosis, surgery)","adult, article, automutilation, case report, clinical article, electric battery, endoscopy, esophagus, female, fork, garbage bag, gastrointestinal surgery, general device, human, ingestion, knife, laparoscopy, melancholia, pens, stomach, toothbrush, tweezer",,,,,,,"Otorhinolaryngology (11), Gastroenterology (48)",,"English",,,37169627,L2024420659,10.1016/j.anorl.2023.04.006,"http://dx.doi.org/10.1016/j.anorl.2023.04.006","https://www.embase.com/search/results?subaction=viewrecord&id=L2024420659&from=export","https://libkey.io/libraries/1675/openurl?sid=EMBASE&sid=EMBASE&issn=18797296&id=doi:10.1016%2Fj.anorl.2023.04.006&atitle=A+dangerous+appetite&stitle=Eur.+Ann.+Otorhinolaryngol.+Head+Neck+Dis.&title=European+Annals+of+Otorhinolaryngology%2C+Head+and+Neck+Diseases&volume=141&issue=2&spage=113&epage=114&aulast=Marie&aufirst=A.&auinit=A.&aufull=Marie+A.&coden=&isbn=&pages=113-114&date=2024&auinit1=A&auinitm=","Copyright 2024 Elsevier B.V., All rights reserved."
"Endoscopist experience with pediatric recurrent and intentional foreign body ingestion (RIFBI): Management considerations and future directions",,"Low Kapalu C.M., Uraizee O., Lerner D.G., Thomson M., Attard T.","(Low Kapalu C.M., lowkapal@ohsu.edu) Pediatric Psychology and Gastroenterology, Oregon Health & Science University, Portland, OR, United States. , (Low Kapalu C.M., lowkapal@ohsu.edu; Attard T.) Gastroenterology, Hepatology and Nutrition, Children's Mercy Kansas City, Kansas City, MO, United States. , (Low Kapalu C.M., lowkapal@ohsu.edu; Attard T.) Department of Pediatrics, University of Missouri Kansas City, Kansas City, MO, United States. , (Uraizee O.) College of Osteopathic Medicine, Kansas City University, Kansas City, MO, United States. , (Lerner D.G.) Section of Gastroenterology, Hepatology, and Nutrition, Medical College of Wisconsin, Milwaukee, WI, United States. , (Thomson M.) Sheffield Children's Hospital NHS Foundation Trust, Sheffield, United Kingdom.","C.M. Low Kapalu, Oregon Health & Science University, 707 SW Gaines St, Portland, OR, United States. Email: lowkapal@ohsu.edu","","2024-03-26","2024-04-02","Journal of Pediatric Gastroenterology and Nutrition (2024) 78:3 (711-719). Date of Publication: 1 Mar 2024","Journal of Pediatric Gastroenterology and Nutrition","2024","78","3","711","719","1 Mar 2024","Article",,,,,"1536-4801 (electronic),0277-2116",,"John Wiley and Sons Inc","Objectives and Study: Accidental foreign body ingestion (FBI) is a common pediatric referral concern. In contrast, recurrent and intentional FBI (RIFBI) is infrequent and associated with greater endoscopic and surgical intervention in adults. Although pediatric guidelines exist for FBI, the risk and therapeutic implications of RIFBI are not addressed. An anonymous international survey on pediatric gastroenterologist experience with RIFBI was distributed. Methods: A 33-item REDCap© survey was distributed via email to pediatric gastroenterologists identified through mailing and email lists obtained from pediatric gastroenterology professional organizations. Results: During 9−12/2021 we accrued 202 completed surveys. Respondents were from 27 countries and across the career span. Eighty percent reported experience with RIFBI; 74% reported seeing ≤ 3 patients with RIFBI within the past 24 months and 4% reported seeing ≥ 6. Of those who treated RIFBI, 38% reported an average number of annual ingestions per patient was ≥5. Frequent morbidity but not mortality was reported. Half reported adherence to FBI guidelines. Later-career endoscopists treated RIFBI more aggressively than accidental ingestion. Ninety-six percent noted that patients with RIFBI had psychiatric comorbidities. Providers at academic medical centers reported referring to behavioral health more than those in other settings. Conclusion: Most gastroenterologists surveyed reported encountering RFBI several times a year and in patients with psychiatric comorbidities. Greater likelihood of adverse outcomes associated with endoscopy was reported. Most reported referral to behavioral health and few had RIFBI management protocols. A broader spectrum of psychologic comorbidities in the pediatric population with RIFBI, notably depression and autism spectrum disorder, were reported.",,"behavioral health,endoscopy,foreign body,multidisciplinary collaboration","","metal, plastic","endoscopist, foreign body (surgery), ingestion, recurrent and intentional foreign body ingestion (surgery)","accident, adverse outcome, article, career, child, childhood mortality, comorbidity, consultation, controlled study, cross-sectional study, device removal, e-mail, electric battery, gastroenterologist, gastrointestinal endoscopy, gastrointestinal hemorrhage, human, magnet, medical literature, medical society, mental disease, morbidity, organization and management, perforation, practice guideline, university hospital",,,,,,,"Psychiatry (32), Gastroenterology (48), Pediatrics and Pediatric Surgery (7)",,"English","English",,38284750,L2029057873,10.1002/jpn3.12114,"http://dx.doi.org/10.1002/jpn3.12114","https://www.embase.com/search/results?subaction=viewrecord&id=L2029057873&from=export","https://libkey.io/libraries/1675/openurl?sid=EMBASE&sid=EMBASE&issn=15364801&id=doi:10.1002%2Fjpn3.12114&atitle=Endoscopist+experience+with+pediatric+recurrent+and+intentional+foreign+body+ingestion+%28RIFBI%29%3A+Management+considerations+and+future+directions&stitle=J.+Pediatr.+Gastroenterol.+Nutr.&title=Journal+of+Pediatric+Gastroenterology+and+Nutrition&volume=78&issue=3&spage=711&epage=719&aulast=Low+Kapalu&aufirst=Christina+M.&auinit=C.M.&aufull=Low+Kapalu+C.M.&coden=JPGND&isbn=&pages=711-719&date=2024&auinit1=C&auinitm=M","Copyright 2024 Elsevier B.V., All rights reserved."
"Animal study: Basic mechanism of vocal cord paralysis caused by button battery ingestion in children",,"Zhang F., Duan Q., Zhou C., Wang G., Zhang J., Ni X.","(Zhang F.; Duan Q.; Wang G.; Zhang J., stzhangj@263.net; Ni X., nixin@bch.com.cn) Department of Otorhinolaryngology Head and Neck Surgery, Beijing Children's Hospital, Capital Medical University, National Center for Children's Health, Beijing, China. , (Zhang F.; Duan Q.; Wang G.; Zhang J., stzhangj@263.net; Ni X., nixin@bch.com.cn) Beijing Key Laboratory for Pediatric Diseases of Otolaryngology, Head and Neck Surgery, Beijing Pediatric Research Institute, Beijing Children's Hospital, Capital Medical University, National Center for Children's Health, Beijing, China. , (Zhou C.) Department of Pathology, Beijing Children's Hospital, Capital Medical University, National Center for Children's Health, Beijing, China.","J. Zhang, Department of Otorhinolaryngology Head and Neck Surgery, Beijing Children's Hospital, Capital Medical University, National Center for Children's Health, Beijing, China. Email: stzhangj@263.net""X. Ni, Department of Otorhinolaryngology Head and Neck Surgery, Beijing Children's Hospital, Capital Medical University, National Center for Children's Health, Beijing, China. Email: nixin@bch.com.cn","","2024-02-01","2024-02-06","International Journal of Pediatric Otorhinolaryngology (2024) 177 Article Number: 111872. Date of Publication: 1 Feb 2024","International Journal of Pediatric Otorhinolaryngology","2024","177",,,,"1 Feb 2024","Article",,,,,"1872-8464 (electronic),0165-5876",,"Elsevier Ireland Ltd","Purpose: Vocal cord paralysis has been reported as a common complication of button battery (BB) ingestion, and there is a need to confirm the mechanism of vocal cord paralysis for the development of a standardized treatment. Methods: A new CR2032 BB and artificial saliva were placed in a fresh pig esophagus with the recurrent laryngeal nerve (RLN); the negative electrode faced the nerve in the experimental group, while the positive electrode faced the nerve in the control group. The pH values of the intra- and extraesophageal walls were measured simultaneously. Pathological examination was performed after the esophagus and nerves were damaged. Results: After BB ingestion, the pH near the intraesophageal negative electrode increased rapidly, reaching 11.5 at 30 min and over 14 at 6 h, while the extraesophageal pH did not change at 1 h and began to accelerate after 2 h, reaching 10 at 6 h. After 6 h of exposure, the pathological section showed that the structure of the mucosa, submucosa, and muscle layer were destroyed; chromatin in the nucleus faded, and part of the nerve bundle in the adventitia had liquefaction necrosis. Conclusion: The basic mechanism of vocal cord paralysis caused by BB ingestion is that the OH(−) generated by the electrolytic reaction of the negative electrode penetrates the esophageal wall and corrodes the RLN, which may be the cause of vocal cord paralysis caused by BB ingestion without esophageal perforation.",,"Button battery,Chemical injury,Foreign body,Vocal cord paralysis","","hydroxide, saliva substitute","chemical injury, foreign body aspiration, vocal cord paralysis (complication)","animal experiment, animal model, animal tissue, article, chemical reaction, chromatin, controlled study, disease simulation, esophagus, esophagus injury, experimental paralysis, human, laryngeal nerve, liquefactive necrosis, nerve injury, nonhuman, pH measurement, pig, tissue injury",,,,,"hydroxide (14280-30-9)",,"Otorhinolaryngology (11), Clinical and Experimental Biochemistry (29)",,"English","English",,38286078,L2030074220,10.1016/j.ijporl.2024.111872,"http://dx.doi.org/10.1016/j.ijporl.2024.111872","https://www.embase.com/search/results?subaction=viewrecord&id=L2030074220&from=export","https://libkey.io/libraries/1675/openurl?sid=EMBASE&sid=EMBASE&issn=18728464&id=doi:10.1016%2Fj.ijporl.2024.111872&atitle=Animal+study%3A+Basic+mechanism+of+vocal+cord+paralysis+caused+by+button+battery+ingestion+in+children&stitle=Int.+J.+Pediatr.+Otorhinolaryngol.&title=International+Journal+of+Pediatric+Otorhinolaryngology&volume=177&issue=&spage=&epage=&aulast=Zhang&aufirst=Fengzhen&auinit=F.&aufull=Zhang+F.&coden=IPOTD&isbn=&pages=-&date=2024&auinit1=F&auinitm=","Copyright 2024 Elsevier B.V., All rights reserved."
"Repeated foreign body ingestion as a dynamic game: A case report",,"Prokop J., Prokop M.","(Prokop J., jacek.prokop@sgh.waw.pl) SGH Warsaw School of Economics, Warsaw, Poland. , (Prokop M.) Green Medica, Warsaw, Poland.","J. Prokop, SGH Warsaw School of Economics, Warsaw, Poland. Email: jacek.prokop@sgh.waw.pl","","2024-03-19","2024-04-16","SAGE Open Medical Case Reports (2024) 12. Date of Publication: 1 Jan 2024","SAGE Open Medical Case Reports","2024","12",,,,"1 Jan 2024","Article",,,,,"2050-313X (electronic)",,"SAGE Publications Ltd","In this case report, we correct the analysis of mitigating intentional foreign body ingestion offered by Sarah J. Diamond and Amnon Sonnenberg. Patients who notoriously swallow foreign objects generate significant economic costs to hospitals. In previous publications, it has been argued that hospitals might reduce the need for endoscopy by offering such patients a paid position to discourage foreign body ingestions. However, the game-theoretical analysis offered in the literature was based on a static game which did not justify the relevant equilibrium. To obtain the actual goal of keeping the patient away from foreign body ingestion, we consider a repeated game with an infinite horizon. We show that there exists a combination of strategies applied by the hospital and the patient that leads to a steady state in which the patient will be discouraged from foreign body ingestion.",,"dynamic game,economic costs,endoscopy,Foreign body ingestion,steady state","","","foreign body, ingestion","article, endoscopy, human, steady state",,,,,,,"Gastroenterology (48)",,"English","English",,,L2028516886,10.1177/2050313X241229859,"http://dx.doi.org/10.1177/2050313X241229859","https://www.embase.com/search/results?subaction=viewrecord&id=L2028516886&from=export","https://libkey.io/libraries/1675/openurl?sid=EMBASE&sid=EMBASE&issn=2050313X&id=doi:10.1177%2F2050313X241229859&atitle=Repeated+foreign+body+ingestion+as+a+dynamic+game%3A+A+case+report&stitle=SAGE+Open+Med.+Case+Reports&title=SAGE+Open+Medical+Case+Reports&volume=12&issue=&spage=&epage=&aulast=Prokop&aufirst=Jacek&auinit=J.&aufull=Prokop+J.&coden=&isbn=&pages=-&date=2024&auinit1=J&auinitm=","Copyright 2024 Elsevier B.V., All rights reserved."
"Unintentional Plastic Blister Ingestion Leading to Intestinal Perforation: A Report of Two Cases",,"Medina Gontier J.C., Wienandts L., Endermann S.","(Medina Gontier J.C., julie.cmg90@gmail.com) Clinic for General, Visceral, Endocrine, and Transplantation Surgery, Cantonal Hospital St. Gallen, St. Gallen, Switzerland. , (Wienandts L.) Clinic for General Internal Medicine, General Practitioner Medicine, and Emergency Medicine, Cantonal Hospital St. Gallen, St. Gallen, Switzerland. , (Endermann S.) Clinic for Anesthesiology, Operative Intensive Care Medicine, Rescue, and Pain Medicine, Cantonal Hospital St. Gallen, St. Gallen, Switzerland.","J.C. Medina Gontier, Clinic for General, Visceral, Endocrine, and Transplantation Surgery, Cantonal Hospital St. Gallen, St. Gallen, Switzerland. Email: julie.cmg90@gmail.com","","2024-04-23","2024-04-24","American Journal of Case Reports (2024) 25 Article Number: e943514. Date of Publication: 2024","American Journal of Case Reports","2024","25",,,,"2024","Article",,,,,"1941-5923 (electronic)",,"International Scientific Information, Inc.","Objective: Unusual clinical course Background: Unintentional medication-blister ingestion is rare but frequently leads to intestinal perforation. The diagnosis of intestinal perforation following blister ingestion is often delayed because of an unreliable history and nonspecific clinical presentation. The purpose of this case report is to raise awareness about a rare but difficult diagnosis and its importance in avoiding potentially fatal events. Case Reports: Herein, we describe successful cases of surgical and endoscopic removal after blister ingestion. The first case was that of a polymorbid 75-year-old man who presented with acute onset of abdominal pain in the right upper quadrant and epigastric regions. No indication of the cause was observed on initial computed tomography (CT). The patient developed an acute abdomen, and emergency laparotomy was performed, during which 2 small perforations were observed in the terminal ileum, and an empty tablet blister was retrieved. The second patient was a 55-year-old man who presented with a considerable lack of awareness. On the initial CT, a subdural hematoma, aspiration, and an unidentified foreign body in the stomach were observed. Gastroscopy was performed after emergency craniotomy. In addition to the initial foreign body, a second object, which had gone unnoticed on the initial CT, was found and removed from the esophagus. Conclusions: With an increased risk of perforation and difficult clinical and radiological diagnoses, prophylactic measures and special awareness of high-risk patients are particularly important.",,"Eating,Endoscopy, Digestive System,Foreign Bodies,General Surgery","plastic","","blister pack, foreign body, ingestion, intestine perforation (diagnosis, surgery)","abdominal aortic aneurysm (diagnosis, surgery), abdominal contusion, abdominal radiography, abdominal surgery, abdominal tenderness, acute abdomen, adult, aged, alcohol consumption, article, cannabis smoking, case report, clinical article, computer assisted tomography, confusion (uncertainty), craniotomy, endovascular aneurysm repair, epigastric pain, gastroscopy, Glasgow coma scale, heroin dependence, human, hypotension, intubation, laparotomy, male, medical history, middle aged, mild cognitive impairment, respiration depression, tobacco dependence, unconsciousness, upper abdominal pain",,,,,,,"Gastroenterology (48)",,"English","English",,38622861,L2028940738,10.12659/AJCR.943514,"http://dx.doi.org/10.12659/AJCR.943514","https://www.embase.com/search/results?subaction=viewrecord&id=L2028940738&from=export","https://libkey.io/libraries/1675/openurl?sid=EMBASE&sid=EMBASE&issn=19415923&id=doi:10.12659%2FAJCR.943514&atitle=Unintentional+Plastic+Blister+Ingestion+Leading+to+Intestinal+Perforation%3A+A+Report+of+Two+Cases&stitle=Am.+J.+Case+Rep.&title=American+Journal+of+Case+Reports&volume=25&issue=&spage=&epage=&aulast=Medina+Gontier&aufirst=Juli+Celina&auinit=J.C.&aufull=Medina+Gontier+J.C.&coden=&isbn=&pages=-&date=2024&auinit1=J&auinitm=C","Copyright 2024 Elsevier B.V., All rights reserved."
