"Gastric perforation after polyurethane foam ingestion",,"Park K.B., Nho W.Y., Yu B., Park J.","(Park K.B.) Department of Surgery, School of Medicine, Kyungpook National University, Kyungpook National University Chilgok Hospital, Daegu, South Korea. , (Nho W.Y., wooyoung.nho@gmail.com; Park J.) Department of Emergency Medicine, School of Medicine, Kyungpook National University, Daegu, South Korea. , (Yu B.) Intensive Care Unit, School of Medicine, Kyungpook National University Chilgok Hospital, Kyungpook National University, Daegu, South Korea.","W.Y. Nho, Department of Emergency Medicine, School of Medicine, Kyungpook National University, Daegu, South Korea. Email: wooyoung.nho@gmail.com","","2024-04-17","2024-05-21","Clinical Toxicology (2024) 62:3 (197-199). Date of Publication: 2024","Clinical Toxicology","2024","62","3","197","199","2024","Article",,,,,"1556-9519 (electronic),1556-3650",,"Taylor and Francis Ltd.","Introduction: Acute intoxication rarely produces conditions that require urgent surgical care. Case summary: A 45-year-old man presented to the emergency department with severe abdominal pain after the deliberate ingestion of 200 cm(3) of polyurethane mixed with methylene diphenyl diisocyanate and urethane primers. On an initial laparoscopic examination, foreign material was observed in the peritoneal space with haemoperitoneum. Emergency exploration was then undertaken for suspected gastric perforation. Full-thickness damage was identified on the stomach wall during the operation. The material in the gastrointestinal tract and peritoneal space was gently removed. Moulded casts of the entire stomach and distal oesophagus were extracted successfully. The patient was discharged 14 days after surgery. Images: Computed tomography revealed foreign material occupying the entire gastric chamber, as well as diffuse gastric perforation. Conclusions: Life-threatening gastric perforation can occur after polyurethane foam ingestion. Clinical/medical toxicologists and emergency physicians need to be aware of the highly expandable nature of this agent.",,"acute care surgery,blast injury,gastric perforation,Polyurethane foam,suicide attempt","polyurethan foam (drug toxicity)","biphenyl derivative, carbene, methylene diphenyldiisocyanate, unclassified drug, urethan","stomach perforation (diagnosis, surgery)","abdominal pain, adult, article, case report, clinical article, computer assisted tomography, emergency surgery, emergency ward, foreign body (diagnosis, surgery), hemoperitoneum, human, human tissue, intoxication, intraoperative period, laparoscopic surgery, male, middle aged, pain severity, peritoneum, stomach wall, suicide attempt",,,,,"carbene (2465-56-7), polyurethan foam (9009-54-5), urethan (51-79-6)",,"Radiology (14), Psychiatry (32), Gastroenterology (48), Toxicology (52), Surgery (9)",,"English","English",,38587093,L2029331173,10.1080/15563650.2024.2330632,"http://dx.doi.org/10.1080/15563650.2024.2330632","https://www.embase.com/search/results?subaction=viewrecord&id=L2029331173&from=export","https://libkey.io/libraries/1675/openurl?sid=EMBASE&sid=EMBASE&issn=15569519&id=doi:10.1080%2F15563650.2024.2330632&atitle=Gastric+perforation+after+polyurethane+foam+ingestion&stitle=Clin.+Toxicol.&title=Clinical+Toxicology&volume=62&issue=3&spage=197&epage=199&aulast=Park&aufirst=Ki+Bum&auinit=K.B.&aufull=Park+K.B.&coden=&isbn=&pages=197-199&date=2024&auinit1=K&auinitm=B","Copyright 2024 Elsevier B.V., All rights reserved."
"Chronic foreign body ingestion in two adults with psychiatric disorder: Is it possible to wait and see? Foreign body ingestion",,"Colapkulu Akgul N., Beyazadam D., Ozsoy M.S., Alımoglu O.","(Colapkulu Akgul N., nuraycolapkulu@gmail.com) Department of General Surgery, Gebze Fatih State Hospital, Kocaeli, Turkey. , (Beyazadam D.) Department of General Surgery, Haydarpasa Numune Training and Research Hospital, Istanbul, Turkey. , (Ozsoy M.S.; Alımoglu O.) Department of General Surgery, Istanbul Medeniyet University, Prof Dr Suleyman Yalcin City Hospital, Istanbul, Turkey.","N. Colapkulu Akgul, Department of General Surgery, Gebze Fatih State Hospital, Kocaeli, Turkey. Email: nuraycolapkulu@gmail.com","","2024-11-28","2024-12-03","Annals of Clinical and Analytical Medicine (2024) 15 Supplement 2 (S85-S88). Date of Publication: 2024","Annals of Clinical and Analytical Medicine","2024","15",,"S85","S88","2024","Article",,,,,"2667-663X (electronic)",,"Derman Medical Publishing","Foreign body ingestion in adults is a rare occurrence; however, intentional ingestion cases are reported among prisoners and individuals with psychiatric disorders. Here, we reported two unusual cases of foreign body ingestion in two adults with psychiatric disorders. A 32-year-old female presented to the emergency department with self-harm to the abdomen to extract a needle under her skin. Radiologic images showed multiple sewing needles in the gastrointestinal tract and adjacent structures. In the other case, a 23-year-old male presented with rectal bleeding after ingesting metallic screws. His previous and new scans revealed multiple metallic screws and safety pins throughout the gastrointestinal tract. Both patients had a history of chronic foreign body ingestion and had never been operated. The aim of this report is to raise a question whether non-operative follow-up could be a treatment of choice after the ingestion of sharp objects such as sewing needles and metallic screws.",,"Conservative Treatment,Eating,Foreign Bodies","","","chronic disease, foreign body, mental disease","abdominal pain, adult, article, case report, clinical article, computer assisted tomography, conservative treatment, eating, emergency ward, female, follow up, gastrointestinal tract, hematochezia, histopathology, human, male, physical examination, schizoaffective psychosis, young adult",,,,,,,"Immunology, Serology and Transplantation (26), Psychiatry (32), Neurology and Neurosurgery (8)",,"English","English",,,L2031991768,10.4328/acam.22190,"http://dx.doi.org/10.4328/acam.22190","https://www.embase.com/search/results?subaction=viewrecord&id=L2031991768&from=export","https://libkey.io/libraries/1675/openurl?sid=EMBASE&sid=EMBASE&issn=2667663X&id=doi:10.4328%2Facam.22190&atitle=Chronic+foreign+body+ingestion+in+two+adults+with+psychiatric+disorder%3A+Is+it+possible+to+wait+and+see%3F+Foreign+body+ingestion&stitle=Annals+of+Clinical+and+Analytical+Medicine&title=Annals+of+Clinical+and+Analytical+Medicine&volume=15&issue=&spage=S85&epage=S88&aulast=Colapkulu+Akgul&aufirst=Nuray&auinit=N.&aufull=Colapkulu+Akgul+N.&coden=&isbn=&pages=S85-S88&date=2024&auinit1=N&auinitm=","Copyright 2024 Elsevier B.V., All rights reserved."
"A Case of Multifactorial Severe Hypophosphatemia",,"Murphy A., Sangoi M., Sabbouh T.","(Murphy A.; Sangoi M.; Sabbouh T.) Pennsylvania Hospital, Philadelphia, PA, United States.","A. Murphy, Pennsylvania Hospital, Philadelphia, PA, United States.","",,"2024-11-14","Journal of the American Society of Nephrology (2024) 35 (1274). Date of Publication: 2024","Journal of the American Society of Nephrology","2024","35",,"1274",,"2024","Conference Abstract","Kidney Week 2024","United States, San Diego, CA","2024-10-23 to 2024-10-27","","1046-6673",,"Wolters Kluwer Health","Introduction: Hypophosphatemia is defined as serum phosphate < 2.5 mg/dL. It is induced by internal redistribution, decreased intestinal absorption, or urinary wasting. We present a case of multifactorial severe hypophosphatemia in the setting of chronic alcoholism and presumed refeeding syndrome. Case Description: A 69 year old male with a history of alcohol use disorder presented to the ED with generalized muscle weakness, recurrent falls and confusion. He reported consuming 2 bottles of wine daily for several years, with his last drink 24 hours prior to presentation. He reported a history of caloric restriction with intentional weight loss followed by a recent increase in caloric intake in the preceding week. His initial presentation was consistent with sepsis from contained sigmoid perforation due to foreign body ingestion, likely a chicken bone. Labs revealed phosphorus < 1, potassium 2.0, magnesium 1.4, lactate 8.5, WBC 6.1 with 34% band neutrophils, mild alkalosis (venous pH 7.43), pCO(2) 42, HCO(3) 24. He was admitted to the ICU and received volume resuscitation, IV antibiotics, management of alcohol withdrawal, intravenous phosphate, potassium and magnesium. Repeat labs showed improved phosphorus to 1.9, however serum corrected calcium decreased from 9.5 to 7.5 mg/dL. He continued to receive further repletion of electrolytes with eventual normalization. Discussion: The etiology of this patient's severe hypophosphatemia was multifactorial from chronic alcoholism and refeeding syndrome. Refeeding syndrome was likely present in this case given the patient's malnutrition and weight loss with recent significantly increased caloric intake resulting in severe hypophosphatemia, hypokalemia and hypomagnesemia. His generalized muscle weakness can be explained by alcoholism and severe electrolyte derangements. Fortunately, he did not develop respiratory failure which is a complication of severe hypophosphatemia as a result of decreased intracellular ATP. For patients with severe hypophosphatemia (< 1 mg/dL), IV phosphate repletion is recommended with level monitoring every six hours. This patient developed hypocalcemia in the setting of phosphate repletion, which is a known complication and should be monitored closely.",,,"","antibiotic agent, calcium, electrolyte, lactic acid, magnesium, phosphate, phosphorus, potassium","hypophosphatemia","adult, alcohol withdrawal syndrome, alcoholism, alkalosis, body weight loss, caloric intake, caloric restriction, carbon dioxide tension, case report, clinical article, complication, conference abstract, confusion, diagnosis, drug therapy, foreign body, human, hypocalcemia, hypokalemia, hypomagnesemia, intensive care unit, intestine absorption, intravenous drug administration, leukocyte count, male, malnutrition, middle aged, muscle weakness, neutrophil, pH, phosphate blood level, refeeding syndrome, respiratory failure, resuscitation, sepsis",,,,,"calcium (7440-70-2, 14092-94-5), lactic acid (113-21-3, 50-21-5), magnesium (7439-95-4), phosphate (14066-19-4, 14265-44-2), phosphorus (7723-14-0), potassium (7440-09-7)",,"",,"English","English",,,L645708271,10.1681/asn.0000000000000448,"http://dx.doi.org/10.1681/asn.0000000000000448","https://www.embase.com/search/results?subaction=viewrecord&id=L645708271&from=export","https://libkey.io/libraries/1675/openurl?sid=EMBASE&sid=EMBASE&issn=10466673&id=doi:10.1681%2Fasn.0000000000000448&atitle=A+Case+of+Multifactorial+Severe+Hypophosphatemia&stitle=J.+Am.+Soc.+Nephrol.&title=Journal+of+the+American+Society+of+Nephrology&volume=35&issue=&spage=1274&epage=&aulast=Murphy&aufirst=Andrew&auinit=A.&aufull=Murphy+A.&coden=&isbn=&pages=1274-&date=2024&auinit1=A&auinitm=","Copyright 2024 Elsevier B.V., All rights reserved."
"Impacted esophageal foreign bodies in children",,"Raju R.S., Raj A.J.M., Shubha A.M.","(Raju R.S., drraju84@gmail.com; Raj A.J.M., michael.john@stjohns.in; Shubha A.M., dramshubha@yahoo.co.in) St. John’s National Academy of Health Sciences, Bengaluru, India.","A.M. Shubha, St. John’s National Academy of Health Sciences, Bengaluru, India. Email: dramshubha@yahoo.co.in","","2023-01-13","2023-01-24","Pediatric Surgery International (2023) 39:1 Article Number: 73. Date of Publication: 1 Dec 2023","Pediatric Surgery International","2023","39","1",,,"1 Dec 2023","Review",,,,,"1437-9813 (electronic),0179-0358",,"Springer Science and Business Media Deutschland GmbH","Purpose: Foreign body (FB) ingestion in children has varied presentation. When unwitnessed, it poses therapeutic and diagnostic challenges especially in the presence of pre-existing anatomical pathology. We aim to analyze the clinical course, management, and outcome of children with impacted esophageal FBs. Methods: Retrospective chart review (Jan 2000–Feb 2018) recruiting children with impacted esophageal FBs. FBs in cricopharynx and those that moved to stomach were excluded. Investigations/management were based on underlying anatomical pathology, duration of impaction, and difficult FBs. Clinical details, management, and outcomes were collated. Results: Of 86 children, N1 = 31 had identifiable predisposing anatomic pathology and N2 = 55 had impactions in normal esophagus or difficult FBs. N1 group presented early (42 months), had recurrent impactions (1–6), and needed multiple dilatations (0–8) and longer follow-up (avg 35 months). Food matter was commonest impaction. Many had persistent symptoms. N2 group had commonly coin impactions and strictures developed in long standing or corrosive FBs. Most were asymptomatic. Conclusion: Abnormal esophageal anatomy predisposes to impaction with organic food bolus. Age of presentation is earlier with recurrent impactions requiring multiple dilatations/surgery and longer follow-up. Metallic FBs commonly impact in normal esophagus and are often innocuous. Atypical/multiple FBs may mirror an underlying psychiatric illness.",,"Dilatation,Esophageal,Foreign body,Impacted,Stricture","","organic matter","esophagus foreign body (surgery), impacted esophageal foreign body (surgery)","airway obstruction, alligator forceps, aspiration pneumonia, balloon catheter, balloon catheterization, child, clinical outcome, coughing, cricopharyngeus muscle, disease course, dysphagia, electric battery, endoscopic biopsy, erythema, esophagogastroduodenoscopy, esophagoscopy, esophagus anastomosis, esophagus atresia, esophagus dilatation, esophagus diverticulosis, esophagus stenosis (surgery), esophagus ulcer, failure to thrive, female, fever, flexible esophagoscope, follow up, gag reflex, gastroesophageal junction, gastroesophageal reflux, gastrostomy, hematemesis, human, human tissue, hydrothorax, hypersalivation, hypotension, invasive ventilation, laparotomy, laryngoscope, laryngoscopy, lower respiratory tract infection, Mac Gill forcep, major clinical study, male, medical record review, operating room, organic food, otorhinolaryngology forceps, pediatric anesthesia, peritonitis, pneumonia, psychological counseling, recurrent disease, recurrent infection, respiratory distress, retching, retrospective study, review, safety pin, shock, stridor, thoracotomy, thorax radiography, tracheoesophageal fistula, vomiting, wheezing",,,"Mac Gill forcep",,,,"Otorhinolaryngology (11), Pediatrics and Pediatric Surgery (7)",,"English","English",,36617341,L2021000364,10.1007/s00383-022-05360-3,"http://dx.doi.org/10.1007/s00383-022-05360-3","https://www.embase.com/search/results?subaction=viewrecord&id=L2021000364&from=export","https://libkey.io/libraries/1675/openurl?sid=EMBASE&sid=EMBASE&issn=14379813&id=doi:10.1007%2Fs00383-022-05360-3&atitle=Impacted+esophageal+foreign+bodies+in+children&stitle=Pediatr.+Surg.+Int.&title=Pediatric+Surgery+International&volume=39&issue=1&spage=&epage=&aulast=Raju&aufirst=Rajkiran+S.&auinit=R.S.&aufull=Raju+R.S.&coden=PSUIE&isbn=&pages=-&date=2023&auinit1=R&auinitm=S","Copyright 2023 Elsevier B.V., All rights reserved."
"Hard to swallow, hard to treat",,"Ishak A., Smith J., Nanda A., Dimaggio F., Thomas R.","(Ishak A.; Smith J.; Nanda A.; Dimaggio F.; Thomas R.) Croydon University Hospital, London, United Kingdom.","A. Ishak, Croydon University Hospital, London, United Kingdom.","",,"2023-12-27","British Journal of Surgery (2023) 110 Supplement 8 (viii24). Date of Publication: 1 Nov 2023","British Journal of Surgery","2023","110",,"viii24",,"1 Nov 2023","Conference Abstract","AUGIS Annual Scientific Meeting 2023","New Zealand, Oxford","2023-09-27 to 2023-09-29","","1365-2168",,"Oxford University Press","Background: Deliberate foreign body ingestion (DFBI) presents unique medical, surgical, and ethical challenges. Often, patients with psychiatric conditions repeatedly ingest foreign bodies, leading to frequent emergency department visits. Standardised management guidelines are lacking, resulting in high hospitalisation rates, interventions, and complications. This study focuses on recent DFBI cases at our institution, providing insights into this complex condition and holistic management. Methods: Patients admitted by the surgical team at Croydon University Hospital between 2017 and 2023 with DFBI were included. Data on demographics, clinical presentation, investigations, and management were collected. Complications, hospitalisations, interventions, and cost analysis were recorded. Results: Eight patients presented a total of 52 times. The incidence of DFBI increased over time. Swallowed objects included knives, needles, magnets, glass, batteries, pencils, gloves, lighters, and screws. Each patient underwent an average of 21 X-rays, 2 CT scans, and 3 OGDs. Eleven laparotomies and 1 laparoscopy were performed. The average length of stay was 44.5 days. Complications included pulmonary embolism, pneumonia, enterotomy, hernia, and infection. The average cost per patient was £30,866.25. Conclusions: DFBI poses a significant burden on healthcare systems. Patients face radiation exposure and repeated invasive interventions, necessitating a comprehensive approach. Understanding DFBI from a biopsychosocial and ethical perspective is crucial. A multidisciplinary team should be involved early, with clear goals. Further research is needed for optimal management pathways.",,,"","","swallow (bird)","adult, clinical article, complication, computer assisted tomography, conference abstract, controlled study, cost benefit analysis, emergency ward, female, foreign body, health care system, human, incidence, intestine surgery, laparotomy, length of stay, lung embolism, male, mental disease, multidisciplinary team, pneumonia, practice guideline, radiation exposure, university hospital, X ray",,,,,,,"",,"English","English",,,L643049187,10.1093/bjs/znad348.067,"http://dx.doi.org/10.1093/bjs/znad348.067","https://www.embase.com/search/results?subaction=viewrecord&id=L643049187&from=export","https://libkey.io/libraries/1675/openurl?sid=EMBASE&sid=EMBASE&issn=13652168&id=doi:10.1093%2Fbjs%2Fznad348.067&atitle=Hard+to+swallow%2C+hard+to+treat&stitle=Br.+J.+Surg.&title=British+Journal+of+Surgery&volume=110&issue=&spage=viii24&epage=&aulast=Ishak&aufirst=Athanasius&auinit=A.&aufull=Ishak+A.&coden=&isbn=&pages=viii24-&date=2023&auinit1=A&auinitm=","Copyright 2023 Elsevier B.V., All rights reserved."
"Ingestion of Foreign Bodies in Prisons: How Should They Be Managed: Study of 13 Cases",,"Mezouari F.A., Haddad F., El Rhaoussi F.Z., Hassani M.T.J., Hliwa W., Bellabah A., Badre W.","(Mezouari F.A.; Haddad F.; El Rhaoussi F.Z.; Hassani M.T.J.; Hliwa W.; Bellabah A.; Badre W.) Department of Hepato-Gastroenterology, Ibn Rochd University Hospital Center, Casablanca, Morocco.","F.A. Mezouari, Department of Hepato-Gastroenterology, Ibn Rochd University Hospital Center, Casablanca, Morocco.","",,"2024-01-12","Turkish Journal of Gastroenterology (2023) 34 Supplement 4 (S93). Date of Publication: 1 Nov 2023","Turkish Journal of Gastroenterology","2023","34",,"S93",,"1 Nov 2023","Conference Abstract","40th National Gastroenterology Week and 11th Congress of Gastrointestinal Surgery","Turkey, Antalya","2023-11-21 to 2023-11-26","","2148-5607",,"AVES","Background/Aims: Intentional ingestion of foreign bodies is a frequent occurrence in the prison environment. The aim of this study is to describe the profile of inmates who have ingested foreign bodies, to determine the nature of these foreign bodies and to specify their management. Materials and Methods: Our retrospective and descriptive study focused' on 13 inmates having ingested' 47 foreign bodies and who consulted the emergency of our department over a 5-year period from January 2018 to July 2023. Results: The study population consisted of 12 men and one woman with an average age of 32 years (24 years-47 years). Foreign bodies ingested by inmates were dominated by batteries (59.52%) followed by lighters (19.04%). The majoritý of foreign bodies were, at the time of discovery, located mainly in the stomach (6 cases) and colon (4 cases). Ingestion resulted in epigastric pain (3 cases), externalized gastrointestinal bleeding with epigastralgia (2 cases), and no symptoms (8 cases). Of the 13 cases of foreign body ingestion, 6 patients underwent endoscopic extraction in the gastroenterology department. Extraction was by diathermic loop, dormia loop and endoscopic basket. Successful extraction was achieved in 4 cases (66.66%), and unsuccessful extraction in 2 cases (33.33%). Only one inmate required surgical extraction, and in 6 patients the elimination of foreign bodies in the stool was spontaneous under medical supervision. Conclusion: Foreign body ingestion is frequent and voluntary in the prison environment. It is characterized by the multiplicity of foreign bodies. The rate of successful extraction of ingested foreign bodies in our practice is satisfactory, requiring an experienced endoscopist to perform the extraction without complications and avoid recourse to surgery. Education of the prison population is important, and psychological follow-up is essential.",,,"","","correctional facility, foreign body, ingestion","adult, aged, clinical article, complication, conference abstract, endoscopist, epigastric pain, female, follow up, gastrointestinal hemorrhage, human, male, prisoner, retrospective study, surgery",,,,,,,"",,"English","English",,,L643178871,10.5152/tjg.2023.101123,"http://dx.doi.org/10.5152/tjg.2023.101123","https://www.embase.com/search/results?subaction=viewrecord&id=L643178871&from=export","https://libkey.io/libraries/1675/openurl?sid=EMBASE&sid=EMBASE&issn=21485607&id=doi:10.5152%2Ftjg.2023.101123&atitle=Ingestion+of+Foreign+Bodies+in+Prisons%3A+How+Should+They+Be+Managed%3A+Study+of+13+Cases&stitle=Turk.+J.+Gastroenterol.&title=Turkish+Journal+of+Gastroenterology&volume=34&issue=&spage=S93&epage=&aulast=Mezouari&aufirst=Fatima+Azzahra&auinit=F.A.&aufull=Mezouari+F.A.&coden=&isbn=&pages=S93-&date=2023&auinit1=F&auinitm=A","Copyright 2024 Elsevier B.V., All rights reserved."
