"Title","Original Title","Author Names","Author Addresses","Correspondence Address","Editors","AiP/IP Entry Date","Full Record Entry Date","Source","Source title","Publication Year","Volume","Issue","First Page","Last Page","Date of Publication","Publication Type","Conference Name","Conference Location","Conference Date","Conference Editors","ISSN","ISBN","Book Publisher","Abstract","Original Abstract","Author Keywords","Emtree Drug Index Terms (Major Focus)","Emtree Drug Index Terms","Emtree Medical Index Terms (Major Focus)","Emtree Medical Index Terms","Drug Tradenames","Drug Manufacturer","Device Tradenames","Device Manufacturer","CAS Registry Numbers","Molecular Sequence Numbers","Embase Classification","Clinical Trial Numbers","Article Language","Summary Language","Embase Accession ID","Medline PMID","PUI","DOI","Full Text Link","Embase Link","Open URL Link","Copyright"
"Clinical practice guidelines in the management of pediatric foreign body aspiration and ingestion: a systematic evaluation using the AGREE II instrument",,"Rizvi A., Rizvi F., Chorath K., Suresh N.V., De Ravin E., Romeo D., Lakshmipathy D., Barrette L.-X., Rajasekaran K.","(Rizvi A.; Rizvi F.) Sidney Kimmel Medical College, Thomas Jefferson University, Philadelphia, PA, United States. , (Chorath K.; Suresh N.V.; Lakshmipathy D.; Barrette L.-X.; Rajasekaran K., karthik.rajasekaran@pennmedicine.upenn.edu) Department of Otorhinolaryngology, University of Pennsylvania, 800 Walnut St, 18th Floor, Philadelphia, PA, United States. , (De Ravin E.) Department of Otolaryngology – Head & amp; Neck Surgery, Thomas Jefferson University, Philadelphia, PA, United States. , (Romeo D.) Perelman School of Medicine, University of Pennsylvania, Philadelphia, PA, United States. , (Rajasekaran K., karthik.rajasekaran@pennmedicine.upenn.edu) Leonard Davis Institute of Health Economics, University of Pennsylvania, Philadelphia, PA, United States.","K. Rajasekaran, Department of Otorhinolaryngology, University of Pennsylvania, 800 Walnut St, 18th Floor, Philadelphia, PA, United States. Email: karthik.rajasekaran@pennmedicine.upenn.edu","","2024-03-05","2024-03-25","Pediatric Surgery International (2024) 40:1 Article Number: 59. Date of Publication: 1 Dec 2024","Pediatric Surgery International","2024","40","1",,,"1 Dec 2024","Article",,,,,"1437-9813 (electronic),0179-0358",,"Springer Science and Business Media Deutschland GmbH","Purpose: Several clinical practice guidelines (CPGs) have been produced to optimize the diagnosis and management of pediatric foreign body aspiration and ingestion. However, to date there have been no critical evaluations of their methodological rigor or quality. Herein, we address this need via the Appraisal of Guidelines for Research and Evaluation (AGREE II) instrument. Methods: A literature search of Embase, MEDLINE via PubMed, and Scopus was performed up until February 25, 2021. Identified CPGs were then assessed by four independent reviewers trained in AGREE II. A scaled domain score of >60% was indicated as satisfactory quality. Intraclass correlation coefficients (ICC) were calculated to assess inter-reviewer agreement. Results: 11 guidelines were assessed with only one being classified as high quality and others being either average (two) or low quality (eight). Domain 4 (clarity of presentation) achieved the highest mean score (66.41 ± 13.33%), while domain 5 (applicability) achieved the lowest score (10.80 ± 10.37%). ICC analysis revealed generally strong agreement between reviewers with a range of 0.60–0.98. Conclusion: Quality appraisal using the AGREE II instrument suggests that the methodologic rigor and quality of current guidelines for the diagnosis and management of pediatric foreign body aspiration and ingestion need significant improvement.",,"AGREE II,Appraisal,Clinical practice guideline,Pediatric foreign body,Quality","","caustic agent","Appraisal of Guidelines for Research and Evaluation II, foreign body, foreign body aspiration, foreign body ingestion, pediatric patient, practice guideline, quality assessment tool","article, Australia, child, correlation coefficient, diagnostic imaging, emergency management, emergency ward, endoscopist, gastrointestinal endoscopy, human, medical society, otolaryngologist, pediatric hospital, pediatric surgeon, pediatrician, quality control, reliability, scoring system, stakeholder engagement, swallowing, symptom",,,,,,,"Chest Diseases, Thoracic Surgery and Tuberculosis (15), Public Health, Social Medicine and Epidemiology (17), Pediatrics and Pediatric Surgery (7)",,"English","English",,38411786,L2028782251,10.1007/s00383-024-05637-9,"http://dx.doi.org/10.1007/s00383-024-05637-9","https://www.embase.com/search/results?subaction=viewrecord&id=L2028782251&from=export","https://libkey.io/libraries/1675/openurl?sid=EMBASE&sid=EMBASE&issn=14379813&id=doi:10.1007%2Fs00383-024-05637-9&atitle=Clinical+practice+guidelines+in+the+management+of+pediatric+foreign+body+aspiration+and+ingestion%3A+a+systematic+evaluation+using+the+AGREE+II+instrument&stitle=Pediatr.+Surg.+Int.&title=Pediatric+Surgery+International&volume=40&issue=1&spage=&epage=&aulast=Rizvi&aufirst=Anza&auinit=A.&aufull=Rizvi+A.&coden=PSUIE&isbn=&pages=-&date=2024&auinit1=A&auinitm=","Copyright 2024 Elsevier B.V., All rights reserved."
"This is a successful removal of more than 450 pieces of metal objects from a patient’s stomach: a case report",,"Farhadi F., Mohtadi A., Pakmehr M., Ghaedamini H., Shafieian F., Aminifar S.A.","(Farhadi F.; Pakmehr M.; Ghaedamini H., Ghaedaminih@gmail.com; Shafieian F.; Aminifar S.A.) Department of General Surgery, School of Medicine, Ahvaz Jundishapur University of Medical Sciences, Ahvaz, Iran. , (Mohtadi A.) Department of Anesthesiology, School of Medicine, Pain Research center Imam Khomeini Hospital, Ahvaz Jundishapur University of Medical Sciences, Ahvaz, Iran.","H. Ghaedamini, Department of General Surgery, School of Medicine, Ahvaz Jundishapur University of Medical Sciences, Ahvaz, Iran. Email: Ghaedaminih@gmail.com","",,"2024-08-23","Journal of Medical Case Reports (2024) 18:1 Article Number: 381. Date of Publication: 1 Dec 2024","Journal of Medical Case Reports","2024","18","1",,,"1 Dec 2024","Article",,,,,"1752-1947 (electronic)",,"BioMed Central Ltd","Background: Ingestion of foreign bodies may be seen unconsciously or intentionally in patients with mental health problems. Most cases pass through the esophagus slowly; however, in some cases, the tumor may be located in narrower areas of the digestive tract that require endoscopic or surgical intervention. This study describes a rare case of successful removal of more than 450 pieces of metal objects from the stomach of a 36-year-old man via ingestion of foreign bodies at Imam Khomeini Hospital in Ahvaz. Case presentation: A 36-year-old male patient (Aryan race) presented with complaints of chronic abdominal pain, frequent vomiting, and intolerance to liquids and food. The patient’s companions mentioned a history of gradual ingestion of small metal objects 3 months prior. The patient was conscious and had stable vital signs. In the patient’s X-ray and endoscopy, multiple metal objects inside the patient’s stomach were observed, causing gastric outlet obstruction. The patient underwent gastrostomy surgery, and 452 screws, nuts, keys, stones, and other metal parts weighing 2900 g were removed from the stomach. Five days after the operation, the patient was transferred to the psychiatric service in good general condition and was diagnosed with psychosis, and her condition returned to normal at follow-up. Conclusion: Successful removal of this foreign body is rare. In chronic abdominal pain, especially in the context of psychiatric disorders, attention should be given to the ingestion of foreign bodies. In swallowing large amounts of sharp and metallic foreign objects, surgical intervention is necessary, especially in cases of obstruction, and saves the patient’s life.",,"Foreign body ingestion,Gastric outlet obstruction,Gastrotomy,Iran","metal","hemoglobin (endogenous compound)","ingestion, pylorus stenosis, stomach","abdominal pain, adult, article, body mass, case report, clinical article, diastolic blood pressure, endoscopy, follow up, foreign body, gastrostomy, gastrotomy, good general condition, hematocrit, human, intensive care unit, international normalized ratio, leukocyte count, male, mental disease, mental health, mental health service, nutritional intolerance, platelet count, psychosis (diagnosis), swallowing, systolic blood pressure, vital sign, vomiting, X ray, X ray analysis",,,,,"hemoglobin (9008-02-0)",,"Psychiatry (32), Gastroenterology (48)",,"English","English",,39148113,L2030993558,10.1186/s13256-024-04672-3,"http://dx.doi.org/10.1186/s13256-024-04672-3","https://www.embase.com/search/results?subaction=viewrecord&id=L2030993558&from=export","https://libkey.io/libraries/1675/openurl?sid=EMBASE&sid=EMBASE&issn=17521947&id=doi:10.1186%2Fs13256-024-04672-3&atitle=This+is+a+successful+removal+of+more+than+450+pieces+of+metal+objects+from+a+patient%E2%80%99s+stomach%3A+a+case+report&stitle=J.+Med.+Case+Rep.&title=Journal+of+Medical+Case+Reports&volume=18&issue=1&spage=&epage=&aulast=Farhadi&aufirst=Farbod&auinit=F.&aufull=Farhadi+F.&coden=&isbn=&pages=-&date=2024&auinit1=F&auinitm=","Copyright 2024 Elsevier B.V., All rights reserved."
"Pharmacokinetic effects of endoscopic gastric decontamination for multidrug gastric pharmacobezoars",,"Marano M., Goffredo B.M., Faraci S., Torroni F., Gowda S.H., Perdichizzi S., Di Nardo M.","(Marano M., marco.marano@opbg.net) Pediatric Poison Control Center, Bambino Gesù Children's Hospital, IRCCS, Rome, Italy. , (Marano M., marco.marano@opbg.net; Perdichizzi S.; Di Nardo M.) Pediatric Intensive Care Unit, Bambino Gesù Children's Hospital, IRCCS, Rome, Italy. , (Goffredo B.M.) Division of Metabolic Biochemistry, Children's Hospital Bambino Bambino Gesù, IRCCS, Rome, Italy. , (Faraci S.; Torroni F.) Digestive Endoscopy and Surgery Unit, Bambino Gesù Children's Hospital, IRCCS, Rome, Italy. , (Gowda S.H.) Department of Pediatrics, Baylor College of Medicine, Texas Children's Hospital, United States.","M. Marano, Pediatric Poison Control Center, Bambino Gesù Children's Hospital, IRCCS, Rome, Italy. Email: marco.marano@opbg.net","","2024-06-27","2024-07-01","Toxicology Reports (2024) 13 Article Number: 101683. Date of Publication: 1 Dec 2024","Toxicology Reports","2024","13",,,,"1 Dec 2024","Article",,,,,"2214-7500",,"Elsevier Inc.","Introduction: Intentional multiple drugs overdose is an often-encountered method of self-harm in adolescence. Treatments include supportive therapy, antidotes (when available) and decontamination techniques with the aim of reducing drugs absorption by the gastrointestinal system to minimize toxicity. Nevertheless, the decontamination techniques currently used, such as gastric lavage (GL), activated charcoal or whole-bowel irrigation, have a questionable effectiveness. Endoscopic gastric decontamination (EGD) treatment for massive ingestion of drugs or formation of pharmacobezoars is currently described only in anecdotal cases. Here we describe the management of an intentional drug overdose in an adolescent patient treated with EGD and the effects of this therapy on drugs pharmacokinetics. Case report: A 15-year-old boy was admitted in an unconscious state (Glasgow Coma Scale: 7–8) to the pediatric intensive care unit after assuming an unspecified amount of quetiapine, aspirin, bisoprolol, fluoxetine, furosemide, alprazolam, and pregabalin pills. Rapid sequence intubation was immediately performed and then the patient was treated with symptomatic therapy and GL with minimal removal of gastric material. Accounting for the type of drugs, the time elapsed from oral assumption and the unknown quantity assumed, EGD was attempted with aim of removing potential aggregate of the drugs. Serial blood samples were taken before and after EGD to measure the plasma level of the drugs. A pharmacobezoar was found and was immediately removed with EGD. The results of the drug monitoring showed that quetiapine exceeded the toxic level reported in literature indicating that it may have been the drug assumed in higher quantity by our patient. PICU stay was uneventful, and the patient was transferred to the psychiatric ward after extubation. Discussion: Our case shows how GL is not effective in mitigating multidrug absorption especially drugs potentially inducing pharmacobezoars. Furthermore, based on our plasma drug monitoring, we believe that early EGD should be considered in all cases of massive pill intake, prolonged release drugs that can form pharmacobezoars or in cases where a life-threatening dose cannot be excluded.",,"Adolescent self-harm,Endoscopic decontamination,Gastric decontamination,Pediatric poisoning,Pharmacobezoar","","acetylsalicylic acid (drug therapy, special situation for pharmacovigilance), alprazolam (drug therapy, special situation for pharmacovigilance), bisoprolol (drug therapy, special situation for pharmacovigilance), fluoxetine (drug concentration, drug therapy, special situation for pharmacovigilance), furosemide (drug therapy, special situation for pharmacovigilance), pregabalin (drug concentration, drug therapy, special situation for pharmacovigilance), quetiapine (drug concentration, drug therapy, special situation for pharmacovigilance)","bezoar (drug therapy), decontamination, endoscopic gastric decontamination, pharmacokinetics","adolescent, article, blood gas analysis, bradycardia, bradypnea, case report, Chromsystems, clinical article, computer assisted tomography, electrocardiography, extubation, female, gastric pharmacobezoar (drug therapy), gastrointestinal endoscopy, Glasgow coma scale, high performance liquid chromatograph, human, ingestion, intubation, liquid chromatography-mass spectrometry, male, pediatric intensive care unit, resuscitation, stomach emptying, UHPLC Agilent 1290 Infinity II 6470",,,"Chromsystems (Chromsystems, Germany), UHPLC Agilent 1290 Infinity II 6470 (Agilent, United States)","Chromsystems (Germany), Agilent (United States)","acetylsalicylic acid (493-53-8, 50-78-2, 53663-74-4, 53664-49-6, 63781-77-1), alprazolam (28981-97-7, 135748-32-2), bisoprolol (66722-44-9), fluoxetine (54910-89-3, 56296-78-7, 59333-67-4, 57226-07-0), furosemide (54-31-9), pregabalin (148553-50-8), quetiapine (111974-72-2, 111974-69-7)",,"Radiology (14), Biophysics, Bioengineering and Medical Instrumentation (27), Drug Literature Index (37), Gastroenterology (48), Pediatrics and Pediatric Surgery (7)",,"English","English",,,L2032949938,10.1016/j.toxrep.2024.101683,"http://dx.doi.org/10.1016/j.toxrep.2024.101683","https://www.embase.com/search/results?subaction=viewrecord&id=L2032949938&from=export","https://libkey.io/libraries/1675/openurl?sid=EMBASE&sid=EMBASE&issn=22147500&id=doi:10.1016%2Fj.toxrep.2024.101683&atitle=Pharmacokinetic+effects+of+endoscopic+gastric+decontamination+for+multidrug+gastric+pharmacobezoars&stitle=Toxicol.+Rep.&title=Toxicology+Reports&volume=13&issue=&spage=&epage=&aulast=Marano&aufirst=&auinit=M.&aufull=Marano+M.&coden=&isbn=&pages=-&date=2024&auinit1=M&auinitm=","Copyright 2024 Elsevier B.V., All rights reserved."
"Foreign body-intestinal canal angle guides management of ingested foreign bodies in the lower gastrointestinal tract",,"Wu L., Chen X.-Y., Ji D., Zhang Z.-G., Mao X.-P.","(Wu L.; Chen X.-Y.; Ji D.; Zhang Z.-G.; Mao X.-P., maoxuping256@163.com) Department of Radiology, The Affiliated Zhangjiagang TCM Hospital of Yangzhou University, No. 77 Changan Road, Jiangsu, Zhangjiagang, China.","X.-P. Mao, Department of Radiology, The Affiliated Zhangjiagang TCM Hospital of Yangzhou University, No. 77 Changan Road, Jiangsu, Zhangjiagang, China. Email: maoxuping256@163.com","","2024-06-11","2024-11-13","Abdominal Radiology (2024) 49:11 (3759-3767). Date of Publication: 1 Nov 2024","Abdominal Radiology","2024","49","11","3759","3767","1 Nov 2024","Article",,,,,"2366-0058 (electronic),2366-004X",,"Springer","Background: Determining whether prompt surgery is required for patient with ingested foreign bodies is clinically important. Purpose: To evaluate the potential value of computed tomography (CT) in guiding the selection of surgical treatment for patients with ingested foreign bodies in the lower gastrointestinal tract. Methods: Between January 2014 and December 2023, we analyzed the data of 58 patients (median age: 65.4 years; range, 31–96 years) with ingested foreign bodies in the lower gastrointestinal tract who underwent CT examinations. Patients were treated either conservatively (35 cases) or surgically (23 cases). The angle between the long axis of the foreign body and the intestinal canal (FB-IC angle) was measured. CT findings and clinical variables were evaluated to identify potential indicators for surgical treatment through univariate and multivariate logistic regression analyses. Results: Univariate analysis revealed the FB-IC angle (P = 0.002), presence of free peritoneal gas (P = 0.002), white blood cell count (P = 0.018), and neutrophil count (P = 0.007) as significant factors associated with surgical treatment. Multivariate analysis demonstrated that the FB-IC angle (odds ratio, 1.033; P = 0.045) and the presence of free peritoneal gas (odds ratio, 41.335; P = 0.002) are independent indicators for surgical management. The FB-IC angle showed an area under the receiver operating characteristic curve of 0.755, with a cutoff value of 51.25 degrees. Conclusion: The FB-IC angle and presence of free peritoneal gas serve as potential predictive imaging markers for surgical intervention. Graphical Abstract: (Figure presented.)",,"Computed tomography,Foreign body,Lower gastrointestinal tract","","contrast medium (intravenous drug administration)","computer assisted tomography, foreign body (diagnosis, surgery), intestinal canal, lower gastrointestinal tract","adult, aged, article, collimator, controlled study, CT scanner, diagnostic accuracy, evaluation study, female, follow up, human, image analysis, image quality, leukocyte count, lower abdominal pain, major clinical study, male, multivariate analysis, multivariate logistic regression analysis, neutrophil count, odds ratio, PACS workstation, picture archiving and communication system, pneumoperitoneum, receiver operating characteristic, retrospective study, risk factor, Somatom Definition AS, treatment indication, univariate analysis, very elderly",,,"PACS workstation (Carestream, United States), Somatom Definition AS (Siemens, Germany)","Carestream, Siemens (Germany), Carestream (United States), Siemens",,,"Radiology (14), Drug Literature Index (37), Gastroenterology (48)",,"English","English",,38829394,L2030083536,10.1007/s00261-024-04404-7,"http://dx.doi.org/10.1007/s00261-024-04404-7","https://www.embase.com/search/results?subaction=viewrecord&id=L2030083536&from=export","https://libkey.io/libraries/1675/openurl?sid=EMBASE&sid=EMBASE&issn=23660058&id=doi:10.1007%2Fs00261-024-04404-7&atitle=Foreign+body-intestinal+canal+angle+guides+management+of+ingested+foreign+bodies+in+the+lower+gastrointestinal+tract&stitle=Abdom.+Radiol.&title=Abdominal+Radiology&volume=49&issue=11&spage=3759&epage=3767&aulast=Wu&aufirst=Lei&auinit=L.&aufull=Wu+L.&coden=&isbn=&pages=3759-3767&date=2024&auinit1=L&auinitm=","Copyright 2024 Elsevier B.V., All rights reserved."
"Hematemesis in a young patient: When the cause is ingested: A case report",,"Aourarh B., Belkouchi L., Saouab R., Aourarh A., Belkouchi O.","(Aourarh B., benayad.aourarh@gmail.com; Aourarh A.) Department of Gastroenterology I, Mohammed V Military Hospital, Mohammed V University, Faculty of medicine and pharmacy of Rabat, Rabat, Morocco. , (Belkouchi L.; Saouab R.) Department of Radiology, Mohammed V Military Hospital, Mohammed V University, Faculty of medicine and pharmacy, Rabat, Morocco. , (Belkouchi O.) Department of Surgery, Mohammed V Military Hospital, Mohammed V University, Faculty of medicine and pharmacy, Rabat, Morocco.","B. Aourarh, Department of Gastroenterology I, Mohammed V Military Hospital, Mohammed V University, Faculty of medicine and pharmacy of Rabat, Rabat, Morocco. Email: benayad.aourarh@gmail.com","","2024-08-06","2024-08-09","Radiology Case Reports (2024) 19:10 (4535-4537). Date of Publication: 1 Oct 2024","Radiology Case Reports","2024","19","10","4535","4537","1 Oct 2024","Article",,,,,"1930-0433 (electronic)",,"Elsevier Inc.","Foreign bodies may be ingested accidentally or intentionally. Generally, they pass through the digestive tract without causing complications unless they become lodged. Patients often present with nonspecific clinical symptoms, and diagnosis is frequently delayed because they do not recall ingesting anything. We report the case of a 20-year-old man who was admitted to the emergency room for acute moderate hematemesis. The patient had no significant medical history. An urgent, nonsedated upper gastrointestinal (GI) endoscopy was performed, which revealed bleeding but no foreign objects. However, an abdominal CT scan identified a linear calcified object in the antrum, which was later confirmed to be a chicken bone upon endoscopic extraction. Ingested foreign bodies typically pass through the digestive tract without incident. However, long, sharp, and thin objects can remain in the gastrointestinal tract for 7-10 days and may become lodged in areas of physiological narrowing. This can lead to complications such as bowel obstruction, perforation, or bleeding.",,"Computed tomography,Endoscopy,Foreign body","","hemoglobin (endogenous compound)","acute disease (diagnosis, etiology, surgery), gastrointestinal hemorrhage (diagnosis, etiology, surgery), hematemesis (diagnosis, etiology, surgery)","abdominal radiography, adult, article, bone, case report, clinical article, computer assisted tomography, disease duration, disease severity, emergency ward, follow up, Gallus gallus, gastrointestinal endoscopy, hemoglobin blood level, hospital admission, human, male, stomach erosion, treatment outcome, young adult",,,,,"hemoglobin (9008-02-0)",,"Radiology (14), Gastroenterology (48)",,"English","English",,,L2033658696,10.1016/j.radcr.2024.07.017,"http://dx.doi.org/10.1016/j.radcr.2024.07.017","https://www.embase.com/search/results?subaction=viewrecord&id=L2033658696&from=export","https://libkey.io/libraries/1675/openurl?sid=EMBASE&sid=EMBASE&issn=19300433&id=doi:10.1016%2Fj.radcr.2024.07.017&atitle=Hematemesis+in+a+young+patient%3A+When+the+cause+is+ingested%3A+A+case+report&stitle=Radiol.+Case+Rep.&title=Radiology+Case+Reports&volume=19&issue=10&spage=4535&epage=4537&aulast=Aourarh&aufirst=Benayad&auinit=B.&aufull=Aourarh+B.&coden=&isbn=&pages=4535-4537&date=2024&auinit1=B&auinitm=","Copyright 2024 Elsevier B.V., All rights reserved."
