Study_ID,Patient_ID,Age_Yrs,Gender,Is_Intentional,Is_Prisoner,Is_Psych_Inpat,Is_Displaced_Person,Under_Influence_Alcohol,Psych_Hx,Severe_Disability_Hx,Previous_Ingestions,Motivation_Intent_To_Harm,Motivation_Protest,Motivation_Psychiatric,Motivation_Psychosocial,Motivation_Unknown,Motivation_Other,Motivation_Other_Long,Object_Button_Battery,Object_Magnet,Object_Long,Object_Diameter_Large,Object_Sharp,Object_Multiple,Object_Other_Long,Outcome_Endoscopy,Outcome_Surgery,Outcome_Death,Outcome_Injury_Needing_Intervention,Outcome_Perforation,Outcome_Obstruction,Outcome_Other,Outcome_Other_Long,Comments,Publication_Year,Authors,Title,Publication_Title,DOI,Study_Country,Study_Design,Citekey,Object_Long_Sharp,Object_Short,Object_Short_Sharp,Outcome_Conservative,Outcome_Endoscopy_Surgery,Motivation_Other_Psych_Hx,Motivation_Other_Severe_Disability_Hx,Patient_Demographic,History_Timeline,Current_Condition,Diagnostic_Assessment,Intervention_Treatment,Post_Intervention_Condition,Harms,Takeaway_Lessons,Overall_Appraisal,Reviewer_Initials,Review_Date,Comments_Reasoning,Outcome_Unknown,Post_Intervention_Condition_Described,Object_Unknown
101,101-002,27.0,Female,1.0,0.0,0.0,,0.0,1.0,0.0,1.0,1.0,0.0,1.0,0.0,1.0,0.0,"“Recurrent ingestion in context of borderline personality disorder and PTSD. Frequently denies suicidal intent; behavior appears habitual, emotionally driven, and occasionally covert. Ingestion paused during long-term inpatient stay, resumed post-discharge.”",,,,,,,Unknown object,,,,,,,,,"“Dx: PTSD + BPD. History of self-injury and suicide attempts. Multiple episodes of ingestion and vaginal insertion of sharp objects. Denied intent in most cases, though suicidal ideation present at times. Ingestion began age 22, paused at 25 during long-term stay, resumed after discharge.”",2007,Gitlin D.F.; Caplan J.P.; Rogers M.P.; Avni-Barron O.; Braun I.; Barsky A.J.,Foreign-body ingestion in patients with personality disorders,Psychosomatics,10.1176/appi.psy.48.2.162,USA,Case Series,Gitlin_2007,0.0,0.0,0.0,1.0,0.0,0.0,0.0,Y,N,N,N,N,N,N,Y,Exclude,JGE,2025-05-08,Does not report outcomes or elaborate on physical condition.,0,,1
101,101-004,53.0,Female,1.0,0.0,0.0,,0.0,1.0,0.0,1.0,0.0,0.0,1.0,0.0,1.0,0.0,,,,,0.0,,,UK,,,,,,,,,"""She often refused to have foreign objects removed from her gastrointestinal tract unless the physicians agreed to surgical intervention for her perineal pain.""",2007,Gitlin D.F.; Caplan J.P.; Rogers M.P.; Avni-Barron O.; Braun I.; Barsky A.J.,Foreign-body ingestion in patients with personality disorders,Psychosomatics,10.1176/appi.psy.48.2.162,USA,Case Series,Gitlin_2007,0.0,0.0,0.0,1.0,0.0,0.0,0.0,Y,N,N,N,N,N,N,Y,Exclude,JGE,2025-05-08,"Psychiatric case report, describing characteristic behaviour, but not clinical details or outcomes.",0,,1
536,536-002,29.0,Male,1.0,1.0,0.0,0.0,0.0,1.0,0.0,0.0,0.0,0.0,1.0,0.0,0.0,0.0,"""auditory hallucinations""",0.0,0.0,,,,0.0,"""metal object in the splenic flexure region""",0.0,0.0,0.0,0.0,0.0,0.0,0.0,,,1998,"Blaho, Kari E.; Merigian, Kevin S.; Winbery, Stephen L.; Park, Lynda J.; Cockrell, Mike",Foreign Body Ingestions in the Emergency Department: Case Reports and Review of Treatment,Journal of Emergency Medicine,10.1016/S0736-4679(97)00229-1,USA,Case Series,Blaho_1998,0.0,0.0,0.0,1.0,0.0,0.0,0.0,Y,N,N,Y,Y,Y,,Y,Exclude,JGE,2025-05-12,Lacks detail of physical assessment.,0,,1
554,554-001,69.0,Male,1.0,0.0,1.0,0.0,0.0,1.0,1.0,1.0,0.0,0.0,1.0,0.0,0.0,0.0,"""pica"" in severely disabled man",,,,,,,,0.0,0.0,1.0,,,1.0,,"""His main symptoms before death were abdominal
pain with distention and no bowel movement for 3 days.
He vomited undigested material before his death, and
this was attributed to intestinal obstruction and car-
diopulmonary arrest. Autopsy permission was not granted
by relatives.""",,2003,"Dumaguing, Noel I.; Singh, Indra; Sethi, Mohammad; Devanand, D. P.",Pica in the geriatric mentally ill: unrelenting and potentially fatal,Journal of Geriatric Psychiatry and Neurology,10.1177/0891988703256049,USA,Case Report,Dumaguing_2003,0.0,0.0,0.0,1.0,0.0,0.0,0.0,Y,N,Y,Y,Y,N,Y,Y,Exclude,JGE,2025-05-12,No autopsy to report cause of death or to prove ingestion of objects.,0,,1
