Study_ID,Comments,Patient_Count,Case_Count,Age_Low,Age_High,Age_Mean,Age_Median,Verified_Ingestion_Cases,Verified_Ingestion_Rate,Gender_Male_Cases,Gender_Male_Rate,Gender_Female_Cases,Gender_Female_Rate,Gender_Unknown_Cases,Gender_Unknown_Rate,Is_Intentional_Cases,Is_Intentional_Rate,Is_Prisoner_Cases,Is_Prisoner_Rate,Is_Psych_Inpat_Cases,Is_Psych_Inpat_Rate,Is_Displaced_Person_Cases,Is_Displaced_Person_Rate,Under_Influence_Alcohol_Cases,Under_Influence_Alcohol_Rate,Psych_Hx_Cases,Psych_Hx_Rate,Severe_Disability_Hx_Cases,Severe_Disability_Hx_Rate,Previous_Ingestions_Cases,Previous_Ingestions_Rate,Motivation_Intent_To_Harm_Cases,Motivation_Intent_To_Harm_Rate,Motivation_Protest_Cases,Motivation_Protest_Rate,Motivation_Psychiatric_Cases,Motivation_Psychiatric_Rate,Motivation_Psychosocial_Cases,Motivation_Psychosocial_Rate,Motivation_Unknown_Cases,Motivation_Unknown_Rate,Motivation_Other_Cases,Motivation_Other_Rate,Motivation_Other_Psych_Hx_Cases,Motivation_Other_Psych_Hx_Rate,Motivation_Other_Severe_Disability_Hx_Cases,Motivation_Other_Severe_Disability_Hx_Rate,Object_Count,Object_Button_Battery_Cases,Object_Button_Battery_Rate,Object_Magnet_Cases,Object_Magnet_Rate,Object_Long_Cases,Object_Long_Rate,Object_Diameter_Large_Cases,Object_Diameter_Large_Rate,Object_Sharp_Cases,Object_Sharp_Rate,Object_Multiple_Cases,Object_Multiple_Rate,Object_Long_Sharp_Cases,Object_Long_Sharp_Rate,Object_Short_Cases,Object_Short_Rate,Object_Short_Sharp_Cases,Object_Short_Sharp_Rate,Outcome_Endoscopy_Cases,Outcome_Endoscopy_Rate,Outcome_Surgery_Cases,Outcome_Surgery_Rate,Outcome_Death_Cases,Outcome_Death_Rate,Outcome_Injury_Needing_Intervention_Cases,Outcome_Injury_Needing_Intervention_Rate,Outcome_Perforation_Cases,Outcome_Perforation_Rate,Outcome_Obstruction_Cases,Outcome_Obstruction_Rate,Outcome_Other_Cases,Outcome_Other_Rate,Outcome_Other_Long,Outcome_Conservative_Cases,Outcome_Conservative_Rate,Outcome_Endoscopy_Surgery_Cases,Outcome_Endoscopy_Surgery_Rate,Publication_Year,Authors,Title,Publication_Title,DOI,Study_Country,Study_Design,Citekey,Clear_Inclusion_Criteria,Standard_Condition_Measurement,Valid_ID_Method,Consecutive_Inclusion,Complete_Inclusion,Clear_Demographic_Reporting,Clear_Clinical_Info_Reporting,Clear_Outcome_Followup_Reported,Clear_Site_Demographic_Reporting,Appropriate_Statistical_Analysis,Overall_Appraisal,Reviewer_Initials,Review_Date,Comments_Reasoning,Setting_Population,Study_Objective,Study_Method,Study_Results,Study_Conclusion,Outcome_Unknown_Rate,Object_Unknown_Rate
256,"Does not give empirical data on population characteristics, or outcomes (apart from mortality and prisoner status). Does not talk about individual motivation, but gives a qualitative description of the typical patient engaging in self-harm in this prison system. ",762.0,472.0,,,,,,,,,,,472.0,1.0,472.0,1.0,472.0,1.0,0.0,0.0,,,,0.066,,0.46,,,,,,,,,,,,,472.0,1.0,,,,,,,1175.0,,,,,,,,,,,,,,,,,,,,,,,1.8880000000000001,0.004,,,,,,,,,,,,,,2016,"Brezean, I; Moldovan, H; Ferechide, D; Vîlcu, M; Petrea, S",Self-harm in the prison system,Romanian Journal Of Legal Medicine,10.4323/rjlm.2016.194,Romania,Case Series,Brezean_2016g,,,,,,N,N,,,,Exclude,,,,,,,,,0,1
288,Mixed suicide attempt population,58.0,17.0,,,36.2,,,,,0.43,,0.57,,0.207,17.0,1.0,0.0,0.0,17.0,1.0,,,,,17.0,1.0,,0.128,,,,,,,,,,,17.0,1.0,,,,,,,,,,,,,,,,,,,,,,,,,,,,,,0.0,0.0,,,,,,,,,,,,,,2018,Tanimoto C.; Yayama S.; Suto S.; Matoba K.; Kajiwara T.; Inoue M.; Endo Y.; Yamakawa M.; Makimoto K.,Self-harm and suicide attempts in a japanese psychiatric hospital,East Asian Archives Of Psychiatry,10.12809/eaapl81732,Japan,Case Series,TanimotoC._2018a,,,,,,N,N,,,,Exclude,,,,,,,,,0,1
312,"IIFO rates were compared according to gender, diagnosis and level of security at a UK inpatient psychiatric facility. Does not report outcomes of interest. ",27.0,133.0,,,,,133.0,1.0,19.0,,114.0,,0.0,0.0,133.0,1.0,0.0,0.0,133.0,1.0,,,,,133.0,1.0,,,,,,,,,,,,,133.0,1.0,,,,,,,142.0,,,,,,,,,,,,,,,,,,,,,,,,,,,,,,,,,,,,,,2019,"Tromans, S; Chester, V; Wells, H; Alexander, R",Deliberate ingestion of foreign bodies as a form of self-harm among inpatients within forensic mental health and intellectual disability services,Journal Of Forensic Psychiatry & Psychology,10.1080/14789949.2018.1530287,,Case Series,Tromans_2019,,,,,,N,N,N,,,Exclude,,,,,,,,,1,1
461,,8.0,52.0,,,,,,,,,,,52.0,1.0,52.0,1.0,,,,,,,,,,,,,,,,,,,,,,,,,,,,,,,,,,,,,,,,,,,,,,,,,,24.0,0.46153846153846156,12.0,0.23076923076923078,,,,,,,,,,,"Complications included pulmonary embolism, pneumonia, enterotomy, hernia, and infection",,,,,2023,"Ishak A., Smith J., Nanda A., Dimaggio F., Thomas R.","Hard to swallow, hard to treat",British Journal Of Surgery,10.1093/bjs/znad348.067,,Case Series,Ishak_2023,,,,,,N,N,,,,Exclude,,,,,,,,,0,1
553,,22.0,75.0,19.0,47.0,28.0,,75.0,1.0,75.0,1.0,0.0,0.0,0.0,0.0,,,75.0,1.0,0.0,0.0,,,,,75.0,1.0,,,,0.64,,,,,,,,,75.0,1.0,,,,,,,256.0,,,,,,,,,,,,,,,,,,,47.25,0.63,9.0,0.12,0.0,0.0,,,2.0,0.02666666666666667,,,4.0,0.05333333333333334,,22.0,0.29333333333333333,3.0,0.04,2002,"Weiland, Steven T; Schurr, Michael J",Conservative Management of Ingested Foreign Bodies,Journal of Gastrointestinal Surgery,10.1016/S1091-255X(01)00027-0,USA,Case Series,Weiland_2002,,,,,,N,N,,,,Exclude,,,,,,,,,0,1
546,,,414.0,6.0,84.0,40.6,,270.0,,233.0,,181.0,,0.0,0.0,12.0,0.029,,,,,,,,,,,,,,,,,,,,,,,414.0,1.0,,,,,,,,,,,,,,,,,,,,,,,,,,419.0,1.0120772946859904,3.0,0.007246376811594203,0.0,0.0,,,,,,,,,,,,3.0,0.007246376811594203,2001,"Mosca, S.; Manes, G.; Martino, R.; Amitrano, L.; Bottino, V.; Bove, A.; Camera, A.; De Nucci, C.; Di Costanzo, G.; Guardascione, M.; Lampasi, F.; Picascia, S.; Picciotto, F. P.; Riccio, E.; Rocco, V. P.; Uomo, G.; Balzano, A.",Endoscopic management of foreign bodies in the upper gastrointestinal tract: report on a series of 414 adult patients,Endoscopy,10.1055/s-2001-16212,Italy,Case Series,Mosca_2001,,,,,,N,N,,,,Exclude,,,,,,,,,0,1
